Title,Points,Url,Time_Posted
Ask HN: Any recommended PR firm for (cash-strapped) startup?,1,http://news.ycombinator.com/item?id=5620145,28 04 00:00
The Best Way To Build Google Author Rank For Insurance Agents,1,http://blog.insurancelibrary.com/google-authorship-integration-with-insurancelibrary-com/,28 04 00:00
After 25 years in jail  the Internet blew my mind ,1,http://www.salon.com/2013/03/14/after_25_years_in_jail_the_internet_blew_my_mind_partner/,28 04 00:00
PayPal Bans BitTorrent VPN / Proxy Service,1,http://torrentfreak.com/paypal-bans-bittorrent-vpn-proxy-service-130427/?utm_source=feedburner&utm_medium=feed&utm_campaign=Feed%3A+Torrentfreak+%28Torrentfreak%29,28 04 00:00
Caring About Context,1,https://medium.com/editors-picks/f3df66315a97,28 04 00:00
Let Me Tell You A Story,2,http://clayallsopp.com/posts/let-me-tell-you-a-story,28 04 00:00
Vermont phone company starts $35 gigabit Internet service,1,http://www.theverge.com/2013/4/26/4271702/vermont-telephone-company-offering-35-per-month-gigabit-internet,27 04 23:00
The Difference between Recursion &amp; Induction,1,http://blog.ezyang.com/2013/04/the-difference-between-recursion-induction/,27 04 23:00
We didn't get in YC  but come and check out the product by a persistent team,2,https://vimeo.com/64973086#,27 04 23:00
Show HN: BetaQ | Build Hype Around Your Launch (startup weekend boulder team),2,http://betaq.co,27 04 23:00
Whats the role of a personal journal in the digital age?,2,http://paidcontent.org/2013/04/27/dear-diary-whats-the-role-of-a-personal-journal-in-the-digital-age/,27 04 23:00
Costume for Women for sale - Fancy Dress Costume UK - womencostume.co.uk,1,http://www.womencostume.co.uk/,27 04 23:00
Antonin Scalia sits next to Bill O'Reilly at White House correspondents dinner,1,http://news.ycombinator.com/item?id=5620014,27 04 23:00
I long for the future where I can safely assume my passwords are stolen,4,https://medium.com/i-m-h-o/898b8f78b021,27 04 23:00
A Special Case of Redis Failover Via Redis Sentinel,1,http://papaya-backend.net/2013/04/25/a-special-case-of-redis-failover-via-redis-sentinel/,27 04 23:00
Which service to print and deliver individual stickers US (or international),3,http://news.ycombinator.com/item?id=5619977,27 04 23:00
Turn WiFi &amp; Bluetooth signals into app actions,8,http://www.newaer.com/developers,27 04 23:00
Original HP Envy Dv4 Smart AC Adapter 65Watt 18.5V 3.5A,1,http://www.anylaptopchargers.com/original-hp-envy-dv4-smart-ac-adapter-65watt.html,27 04 23:00
Mark Zuckerberg moves his empire to Galt's Gulch,8,http://digbysblog.blogspot.com/2013/04/mark-zuckerberg-moves-his-empire-to.html,27 04 23:00
Ask HN: What web development language do you prefer?,4,http://news.ycombinator.com/item?id=5619955,27 04 23:00
The Brain: Our Food-Traffic Controller,1,http://www.nytimes.com/2013/04/28/opinion/sunday/the-brain-our-food-traffic-controller.html,27 04 23:00
Here's How Little Math Americans Actually Use at Work,2,http://www.theatlantic.com/business/archive/2013/04/heres-how-little-math-americans-actually-use-at-work/275260/,27 04 23:00
The Craft of Text Editing,1,http://www.finseth.com/craft/#preface,27 04 23:00
Dont Replace Religion; End It,8,http://www.nytimes.com/roomfordebate/2013/01/22/is-atheism-a-religion/atheism-should-end-religion-not-replace-it,27 04 23:00
Coloroyale Launches at Startup Weekend Boulder - 54 shirts in 54 hours,1,http://coloroyale.com/,27 04 23:00
What Does Free as in Speech or Free as in Beer Really Mean?,1,http://www.howtogeek.com/howto/31717/what-do-the-phrases-free-speech-vs.-free-beer-really-mean/,27 04 23:00
A rubygem for natural spelling and grammar checker.,16,https://github.com/subosito/gingerice,27 04 23:00
Spain's self-cannibalizing downward spiral,1,http://marginalrevolution.com/marginalrevolution/2012/05/what-views-can-you-hold-about-spain.html,27 04 23:00
TraceGL: A JavaScript Codeflow Visualization and Debugging Tool using WebGL,1,http://badassjs.com/post/48702496345/tracegl-a-javascript-codeflow-visualization-and,27 04 22:00
How is done authentication at Google Glass?,1,http://news.ycombinator.com/item?id=5619857,27 04 22:00
Cross-Platform Mobile App Development With HTML5 - Which Way To Go?,1,http://www.technogist.com/2013/04/cross-platform-mobile-app-development.html,27 04 22:00
E-Cigarettes Bring Smokers Back Inside  For Now,37,http://www.npr.org/2013/04/27/179490799/e-cigarettes-bring-smokers-back-inside-for-now,27 04 22:00
Safari Updates Add Extra Layer of Java Protection,1,http://tidbits.com/article/13716,27 04 22:00
Common browser misconceptions explained ,1,http://www.ksdk.com/news/article/377491/3/3-common-browser-misconceptions-explained-,27 04 22:00
From Idea To Development  A Few Hours In At The TechCrunch Disrupt NY Hackathon,1,http://techcrunch.com/2013/04/27/from-idea-to-development-a-few-hours-in-at-the-techcrunch-disrupt-ny-hackathon/,27 04 22:00
What is Java?,1,http://www.technewsdaily.com/17887-what-is-java.html,27 04 22:00
How You Get Hacked at Starbucks,1,http://mashable.com/2013/04/27/hacked-starbucks/,27 04 22:00
This German bands GeoCities site successfully redirects to their Facebook page,1,http://www.reocities.com/SunsetStrip/Lounge/1234/,27 04 22:00
How to Build an Instagram-like Photo Sharing App with HTML5: Part 2,1,http://www.sitepoint.com/how-to-build-an-instagram-like-photo-sharing-app-with-html5-part-2/,27 04 22:00
What's the ROI for This Article?,1,http://mashable.com/2013/04/27/roi-definition/,27 04 22:00
Disrupt NY 2013 Hackathon Team Wants To Build A WebRTC-Based Pandora,1,http://techcrunch.com/2013/04/27/disrupt-ny-2013-hackathon-team-wants-to-build-a-webrtc-based-pandora-for-exercise/,27 04 22:00
When Your Data Wanders to Places Youve Never Been,1,http://www.nytimes.com/2013/04/28/technology/personal-data-takes-a-winding-path-into-marketers-hands.html,27 04 22:00
6 Tips to Help You Land Your Dream Job,1,http://mashable.com/2013/04/27/work-tips-dream-job/,27 04 22:00
10 top time-saving tech tips,1,http://www.ted.com/talks/david_pogue_10_top_time_saving_tech_tips.html,27 04 22:00
The TechCrunch Disrupt NY Hackathon Is On And Poppin,1,http://techcrunch.com/2013/04/27/the-techcrunch-disrupt-ny-hackathon-is-on-and-poppin/,27 04 22:00
Why bad games could be everything you hoped for,1,http://venturebeat.com/2013/04/27/dont-buy-that-game-they-said-you-wont-like-it-they-said/,27 04 22:00
Synergist Founder Hopes To Raise $25K,1,http://techcrunch.com/2013/04/27/synergist-funds-itself/,27 04 22:00
Inspiring vision of Boeing's futuristic supersonic jet,1,http://www.newscientist.com/article/dn23450-inspiring-vision-of-boeings-futuristic-supersonic-jet.html?cmpid=RSS|NSNS|2012-GLOBAL|online-news,27 04 22:00
Apple Seeks Feedback From Residents On 'Campus 2' Expansion,1,http://mashable.com/2013/04/27/apple-campus-2/,27 04 22:00
Meet Some Hackers And Their Promising Projects At The Disrupt NY Hackathon,1,http://techcrunch.com/2013/04/27/meet-the-hackers-and-their-promising-projects-at-the-disrupt-ny-hackathon/,27 04 22:00
MAVEPAY: a new lightweight payment scheme for peer to peer currency networks,2,http://bitslog.wordpress.com/2012/04/16/mavepay-a-new-lightweight-payment-scheme-for-peer-to-peer-currency-networks/,27 04 21:00
Rethinking J-school,15,https://medium.com/i-m-h-o/b8d43e4c204d,27 04 21:00
Facebook's Mark Zuckerberg Joins the $1 Salary Club,1,http://mashable.com/2013/04/27/mark-zuckerberg-1-dollar-salary/,27 04 21:00
How to write simple  useful and composable javascript applications,1,http://killdream.github.io/blog/2013/04/the-hikkikomoris-guide-to-javascript/,27 04 21:00
Let's create a Wikipedia page for Rich Hickey,20,https://twitter.com/sferik/status/328308095463870464,27 04 21:00
Why Facebook Won with the Parse Acquisiton,1,http://francescak.me/blog/2013/04/27/why-facebook-won-with-the-parse-acquisiton/,27 04 21:00
How Big Data Is Playing Recruiter for Specialized Workers,2,http://www.nytimes.com/2013/04/28/technology/how-big-data-is-playing-recruiter-for-specialized-workers.html?smid=pl-share,27 04 21:00
Uber In NYC Shows What's Really Wrong With The US Economy,1,http://www.forbes.com/sites/timworstall/2013/04/27/uber-in-nyc-shows-whats-really-wrong-with-the-us-economy/,27 04 21:00
Why U.S. College Students Are So Stupid,1,http://internetisinamerica.blogspot.co.uk/2011/12/why-us-college-students-are-so-stupid.html,27 04 21:00
Csfoundation,1,http://lnkd.in/E5RX83,27 04 21:00
Cybernetics,2,http://en.wikipedia.org/wiki/Cybernetics,27 04 21:00
How to Sell a Chicken Suit,1,http://eigenjoy.com/2013/04/27/how-to-sell-a-chicken-suit/,27 04 21:00
If you want to succeed  start a company instead of writing a resume,1,http://qz.com/78975/if-you-want-to-succeed-start-a-company-instead-of-writing-a-resume/,27 04 21:00
Bukit Gambang Resort,1,http://www.gambangwaterpark.com/bukit-gambang-resort/,27 04 21:00
Ask HN: Solr Hosting in the cloud,1,http://news.ycombinator.com/item?id=5619540,27 04 20:00
The Problem With How We Treat Bipolar Disorder,19,http://www.nytimes.com/2013/04/28/magazine/the-problem-with-how-we-treat-bipolar-disorder.html?pagewanted=1&_r=0&ref=general&src=me,27 04 20:00
Adam Jacob ChefConf Keynote,4,http://www.youtube.com/watch?v=Hb4y0EHfOFQ,27 04 20:00
Actors on the JVM,1,http://www.javaworld.com/javaworld/jw-03-2009/jw-03-actor-concurrency2.html,27 04 20:00
Test cases with less duplicated manual labour by leveraging git diff,1,https://twitter.com/shurcool/status/328201918646198273,27 04 20:00
Insights from Coders at Work,1,http://www.recursion.org/2013/1/6/insights-from-coders-at-work,27 04 20:00
I increased 8% revenue by using variable pricing in selling digital goods,2,http://es.slideshare.net/kitebit/kitebit-variable-pricing-20035154,27 04 20:00
SF Pride capitulates  drops Manning,1,http://www.salon.com/2013/04/27/sf_pride_capitulates_drops_manning/,27 04 20:00
AWS Launches CloudHSM  Hardware Security Module For Managing Cryptographic Keys,21,http://techcrunch.com/2013/03/26/amazon-web-services-launches-cloudhsm-a-dedicated-hardware-security-appliance-for-managing-cryptographic-keys/,27 04 20:00
Skip Google+ Sharing And Tweet Photos Directly From Google Glass With GlassTweet,1,http://techcrunch.com/2013/04/27/skip-google-sharing-and-tweet-photos-directly-from-google-glass-with-glasstweet/,27 04 20:00
Spain Is Beyond Doomed: Unemployment Charts,54,http://www.theatlantic.com/business/archive/2013/04/spain-is-beyond-doomed-the-2-scariest-unemployment-charts-ever/275324/,27 04 20:00
How Not to Die,2,http://www.theatlantic.com/magazine/archive/2013/05/how-not-to-die/309277/,27 04 20:00
Dispelling Stereotypes  On Stage And Off [Inspiration],1,http://www.nytimes.com/2013/04/28/jobs/an-actor-and-comedian-aiming-to-dispel-stereotypes.html,27 04 20:00
Facebook Tells Parse Developers No Plans To Change How App Data Is Used,34,http://techcrunch.com/2013/04/27/parse-facebook/,27 04 20:00
Blame Photoshop for Koreas Beauty Queen Clones?,1,http://kotaku.com/blame-photoshop-for-koreas-beauty-queen-clones-482285894,27 04 20:00
Everyone Should Try a Startup,2,http://kamilmroczek.com/2013/04/23/everyone-should-try-a-start-up/,27 04 19:00
Weird Science and the remembrance of fists past,1,http://arstechnica.com/science/2013/04/weird-science-and-the-remembrance-of-fists-past/?utm_source=feedburner&utm_medium=feed&utm_campaign=Feed%3A+arstechnica%2Findex+%28Ars+Technica+-+All+content%29,27 04 19:00
Rails 4 Postgres UUID Primary Key Guide ,3,http://labria.github.io/2013/04/28/rails-4-postgres-uuid-pk-guide/,27 04 19:00
How To Split A Pizza,32,http://schani.wordpress.com/2013/04/27/how-to-split-a-pizza/,27 04 19:00
MacroPy Parser Combinators: Pushing the limits of embedded DSLs in Python,1,https://github.com/lihaoyi/macropy#parser-combinators,27 04 19:00
Mpemba effect: warmer water can freeze faster than colder water,16,https://en.wikipedia.org/wiki/Mpemba_effect,27 04 19:00
Dutch psychologist admits research fraudand the lessons,3,http://whyevolutionistrue.wordpress.com/2013/04/27/dutch-psychologist-admits-research-fraud-and-the-lessons/,27 04 19:00
ping `curl whatismyip.akamai.com`,20,http://whatismyip.akamai.com/,27 04 19:00
Ad guy says the tracking cookie will be dead in five years,2,http://venturebeat.com/2013/04/27/tracking-cookie-dead-soon-maybe/,27 04 19:00
Compressing Homogeneous JSON,2,https://github.com/WebReflection/json.hpack/wiki,27 04 19:00
NASA launches $7000 smartphone satellites,1,http://www.nasa.gov/home/hqnews/2013/apr/HQ_13-107_Phonesat.html,27 04 19:00
JavaScript Namespaces and Modules,2,http://www.kenneth-truyers.net/2013/04/27/javascript-namespaces-and-modules/,27 04 19:00
Molyneux's problem,36,https://en.wikipedia.org/wiki/Molyneux%27s_problem,27 04 19:00
Leadership and Creating a Movement,2,http://www.kashflow.com/blog/dancing-guy/,27 04 19:00
IUs petaflop supercompter is the first to be a dedicated university resource,1,http://arstechnica.com/information-technology/2013/04/ius-petaflop-supercompter-is-the-first-to-be-a-dedicated-university-resource/?utm_source=feedburner&utm_medium=feed&utm_campaign=Feed%3A+arstechnica%2Findex+%28Ars+Technica+-+All+content%29,27 04 19:00
About my new Bitcoin vulnerability: get your peer public addresses,2,http://bitslog.wordpress.com/2013/01/23/new-bitcoin-vulnerability-get-your-peer-public-addresses/,27 04 19:00
Computers are the new Freud of Dreams,1,http://www.ecnmag.com/blogs/2013/04/computers-are-new-freud-dreams,27 04 18:00
There is no excuse to get started with hardware,1,http://www.modk.it,27 04 18:00
Ask HN: Do you check for HTTPS before signing up for a site?,5,http://news.ycombinator.com/item?id=5619195,27 04 18:00
Jeff Bezos's Regret Minimization Framework,13,http://www.youtube.com/watch?v=jwG_qR6XmDQ,27 04 18:00
Making Cents  the meager royalties paid out to bands by streaming services,58,http://pitchfork.com/features/articles/8993-the-cloud/,27 04 18:00
Fun with the Anthropic Principle,2,http://beust.com/weblog/2010/08/17/fun-with-the-anthropic-principle/,27 04 18:00
66 Behind the Scenes Pics from THE EMPIRE STRIKES BACK,10,http://imgur.com/a/HGtG0,27 04 18:00
The 5 values that drive 500 Startups,2,http://thenextweb.com/insider/2013/04/27/the-5-values-that-drive-500-startups/,27 04 18:00
Ask HN: Marketing methods for startups,4,http://news.ycombinator.com/item?id=5619145,27 04 18:00
Show HN: Notforest - cleaning up the Web one page at a time,17,http://www.notforest.com/,27 04 18:00
Helpful Helping Hands,1,https://www.wrbishop.com/hardware/helpful-helping-hands/,27 04 18:00
A case of mistaken identity,1,http://programmersbreadth.blogspot.com/2013/04/a-case-of-mistaken-identity.html,27 04 18:00
Install your own open source private cloud with ownCloud,1,https://www.wrbishop.com/it/install-your-own-open-source-private-cloud-with-owncloud/,27 04 18:00
Megafilter - A Personal Google Reader Replacement,1,http://blog.cloudno.de/blog/2013/04/27/megafilter-a-personal-google-reader-replacement/,27 04 18:00
Are There Any Good Reasons For DRM?,2,http://ask.slashdot.org/story/13/04/27/1753211/ask-slashdot-are-there-any-good-reasons-for-drm,27 04 18:00
Voxels vs. Polygons,19,http://40westdesigns.com/blog/?p=371,27 04 18:00
Atomic Scala,7,http://www.atomicscala.com,27 04 18:00
In town for YC? Come grub tonight with dogwalkingco,1,https://www.grubwithus.com/meals/yc-interview-week-dinner-v4bx4wij,27 04 18:00
17 years old guy finds a critical CSRF vulnerability on Twitter,1,http://news.ycombinator.com/item?id=5619088,27 04 18:00
Medium's X-Powered-By' HTTP Header,1,https://medium.com/what-i-learned-today/42f7eee1597b,27 04 18:00
I am not now  nor have I ever been*  Satoshi Nakamoto,2,http://vinay.howtolivewiki.com/blog/other/i-am-not-now-nor-have-i-ever-been-satoshi-nakamoto-3368,27 04 18:00
Still looking?,1,http://www.moreofless.co.uk/still-looking/,27 04 18:00
From Veewee  to Vagrant  then Chef,1,http://www.thoughtlessbanter.com/blog/2013-04-27-from-vewee-to-vagrant-then-chef/,27 04 18:00
Ask HN: Would you find this developer service useful?,1,http://news.ycombinator.com/item?id=5619062,27 04 18:00
Robot Balance Project,1,http://www.philipithomas.com/robot-balance/,27 04 18:00
How to Raise Money When Youre Not in a Major VC Market,1,http://www.bothsidesofthetable.com/2013/04/27/how-to-raise-money-when-youre-not-in-a-major-vc-market/,27 04 18:00
My two-week review of Google Glass,29,https://plus.google.com/+Scobleizer/posts/ZLV9GdmkRzS,27 04 18:00
Falling-sky - Test users for IPv6 problems - Google Project Hosting,1,https://code.google.com/p/falling-sky/,27 04 18:00
Ctt - time tracking for geeks - now supports regexp,1,http://www.nico.schottelius.org/blog/ctt-0.8-released/,27 04 18:00
EVE Online developers create EVR for Oculus Rift,2,http://www.theverge.com/2013/4/26/4271884/oculus-rift-eve-online-evr-space-dogfighting-proof-of-concept,27 04 17:00
LivingSocial Hacked: More than 50 Million Customers' Data May Be Compromised,1,http://abcnews.go.com/Technology/livingsocial-hacked-50-million-customers-data-compromised/story?id=19057439#.UXw8I6K-qt8,27 04 17:00
The US Banking System Is Insecure,2,http://www.maxhodak.com/notes/2013/04/27/insecure-banking.html,27 04 17:00
Meta Coin: MetaTrader meets Bitcoin  and other crypto currencies.,1,http://www.meta-coin.com,27 04 17:00
Find Sports to Play,1,http://vespyr.co,27 04 17:00
The Amanda Palmer problem,15,http://www.vulture.com/2013/04/the-amanda-palmer-problem.html,27 04 17:00
Will Iran's national Internet mean no world wide web?,1,http://www.bbc.co.uk/news/world-middle-east-22281336,27 04 17:00
New app reveals painting's past with a swipe,1,http://www.nbcnews.com/technology/gadgetbox/new-app-reveals-paintings-past-swipe-6C9644962,27 04 17:00
In defense of wonk journalism  Future of News,1,https://medium.com/future-of-news/cc884cce6349,27 04 17:00
Google Glass: How it Feels (video),1,http://www.google.com/glass/start/how-it-feels/,27 04 17:00
JPQL: The Basics of the Java Persistence Query Language,1,https://tothought.cloudfoundry.com/post/15,27 04 17:00
One way to fix your rubbish password database,1,http://blog.jgc.org/2012/06/one-way-to-fix-your-rubbish-password.html?m=1,27 04 17:00
Startup Failure Insight: Industry Projections Until 2017 [Infographic],1,http://www.bitrebels.com/business-2/startup-failure-insight-projections-2017/,27 04 17:00
From Degrading to De-Grading,1,http://www.alfiekohn.org/teaching/fdtd-g.htm,27 04 17:00
Remote control your iOS app,1,http://berzniz.com/post/49031590163/remote-control-your-ios-app,27 04 17:00
Randomly making a small test case out of a big one,2,https://plus.google.com/114613808538621741268/posts/iHtxL1isbBW,27 04 17:00
Start Ugly Things,1,https://medium.com/what-i-learned-building/3888081206eb,27 04 17:00
Osaka Station fountain displays time  art in water,3,http://newslamp.com/post/74496/osaka-station-fountain-displays-time-art-in-water,27 04 17:00
Inspecting the shaders of Rage,1,http://renderingpipeline.com/2012/03/inspecting-the-shaders-of-rage/,27 04 17:00
New Web Domain Names: Should You Pass?,1,http://www.informationweek.com/cloud-computing/software/new-web-domain-names-should-you-pass/240151540,27 04 17:00
Teaching &gt; Spending,1,https://medium.com/what-i-learned-today/56aee7e52204,27 04 17:00
Ask HN: programming with a chording keyboard,1,http://news.ycombinator.com/item?id=5618872,27 04 16:00
The makers of hardware innovation,1,http://radar.oreilly.com/2013/04/the-makers-of-hardware-innovation.html,27 04 16:00
Timing is not just for traders anymore. Networks need it too,17,http://gigaom.com/2013/04/27/timing-is-not-just-for-traders-anymore-networks-need-it-too/,27 04 16:00
Show HN: A Marketplace for Status Updates,1,http://backscratch.com,27 04 16:00
Consumers' shift to older iPhones raises concerns on Wall Street,1,"http://www.latimes.com/business/la-fi-apple-iphone-20130426,0,7968879.story",27 04 16:00
Invest in people  not resources,1,http://pandodaily.com/2013/04/26/invest-in-people-not-resources/,27 04 16:00
It's for the orphans,1,http://robots.thoughtbot.com/post/49004256633/its-for-the-orphans,27 04 16:00
Wrap up of a mind blowing week in the world of APIs,1,http://www.3scale.net/2013/04/acquisitions-and-investments-towards-a-future-of-apis/,27 04 16:00
These Huge Brands' Early Websites From The 1990s Looked Terrible,1,http://www.businessinsider.com/big-brands-90s-websites-look-terrible-2013-4#,27 04 16:00
A child's age starts counting when it's a song in his mother's mind,10,http://thegodmolecule.tumblr.com/post/48146343226/here-is-a-tribe-in-africa-where-the-birth-date-of,27 04 16:00
The Dark Side of Energy Independence,2,http://www.nytimes.com/2013/04/28/opinion/sunday/the-dark-side-of-energy-independence.html?pagewanted=all,27 04 16:00
Bruce Eckel on why he's moving back to Windows from Mac,55,http://www.artima.com/weblogs/viewpost.jsp?thread=350864,27 04 16:00
Bret Victor: Upcoming Videos,1,http://worrydream.com/May2013,27 04 16:00
 Is Google Glass a World-Class Hoax?,2,"http://www.pcmag.com/article2/0,2817,2418223,00.asp",27 04 16:00
TCDisrupt SF Hackathon Grand prize winner's TCDisrupt NYC Project Today,1,https://www.hackerleague.org/hackathons/techcrunch-disrupt-nyc-2013/hacks/ardwifi,27 04 16:00
Has Apple released todays reports?,1,http://appfigures.com/itcstatus,27 04 16:00
Why LivingSocials 50 million password breach is graver than you may think,36,http://arstechnica.com/security/2013/04/why-livingsocials-50-million-password-breach-is-graver-than-you-may-think/?utm_source=feedburner&utm_medium=feed&utm_campaign=Feed%3A+arstechnica%2Findex+%28Ars+Technica+-+All+content%29,27 04 16:00
Hey Look A Dishonest Whitepaper (iPad vs Dell Tablet),2,http://lepinski.net/2013/04/hey-look-a-dishonest-whitepaper/,27 04 16:00
The next Xbox rethinks DRM  Achievements and Xbox Live friends,1,http://www.polygon.com/2013/4/26/4268782/next-xbox-drm-achievements-live,27 04 16:00
Trade Glitches Test Investors Fragile Faith in Market,1,http://finance.yahoo.com/blogs/michael-santoli/trade-glitches-test-investors-fragile-faith-market-144803557.html,27 04 16:00
Korean Beauty Contestants  Face Morphing,121,http://jbhuang0604.blogspot.com/2013/04/miss-korea-2013-contestants-face.html,27 04 15:00
Show HN: This week I released my first Android game.,1,http://news.ycombinator.com/item?id=5618713,27 04 15:00
Samsung's SAIT (Advanced Institute of Tech): A highly publicized Skunk Works,1,http://worldofskunkworks.blogspot.com/2013/03/samsungs-sait-highly-publicized-skunk.html,27 04 15:00
Findings  May 2013,1,http://harpers.org/archive/2013/05/findings-50/,27 04 15:00
Harper's Index  May 2013,1,http://harpers.org/archive/2013/05/harpers-index-350/,27 04 15:00
Fundamental Problems of Lisp,1,http://xahlee.info/UnixResource_dir/writ/lisp_problems.html,27 04 15:00
Why Farhad Manjoo from Slate sold all of his Bitcoins,1,http://www.slate.com/articles/technology/technology/2013/04/bitcoin_investing_i_made_152_by_speculating_in_digital_currency_take_that.html,27 04 15:00
Build Twitter bot with erlang and Ybot,1,http://0xax.github.io/Build-Twitter-Bot-With-Ybot.html,27 04 15:00
Bhutan set to plough lone furrow as world's first wholly organic country,1,http://www.guardian.co.uk/global-development/poverty-matters/2013/feb/11/bhutan-first-wholly-organic-country,27 04 15:00
Racially Segregated Proms Still Exist in Pockets of the South,1,http://www.nytimes.com/2013/04/27/us/in-rural-georgia-students-step-up-to-offer-integrated-prom.html?hp,27 04 15:00
Things I dont have that many do :mnmlist,1,http://mnmlist.com/havent/,27 04 15:00
Email Mistakes That Irritate Smart People,3,http://brooksreview.net/2010/07/email-mistakes-that-irratate-smart-people/,27 04 15:00
Show HN: Star Ratings for Shopify Products,10,http://rating-widget.com/blog/success-story-meet-our-awesome-shopify-app-customer/,27 04 15:00
A Quick Introduction to SuperCollider,1,http://designingsound.org/2013/04/a-quick-introduction-to-supercollider/,27 04 15:00
Ember Fest Hackathon - Help make it happen,1,http://emberfest.eu/pages/hackathon,27 04 15:00
A site I made to make London look sunnier on Street View (Chrome only),14,http://www.ianbutterworth.co.uk/sun/,27 04 15:00
What Is The Point of The Check-In?,1,http://zerodistraction.com/what-is-the-point-of-the-check-in/,27 04 15:00
IPhone 5 is Kubrick's monolith,1,http://stritar.net/Post/iPhone-5-is-Kubrick-s-monolith.aspx,27 04 15:00
A Platform to Call My Own,1,http://minglis.id.au/blog/a-platform-to-call-my-own,27 04 15:00
#Music: 3 Australians who took Twitter into music,1,http://www.afr.com/p/business/companies/the_tweet_sound_of_music_6MrUxN4KGOItnCkEnWOAeN,27 04 15:00
A photographer's quest to appreciate the best escalators in the world,2,http://mobile.theverge.com/2013/4/27/4274398/a-photographers-quest-to-appreciate-and-database-the-best-escalators,27 04 15:00
Recursion or while loops: Which is better?,2,http://arstechnica.com/information-technology/2013/04/recursion-or-while-loops-which-is-better/,27 04 15:00
Systems: Because You Can't Count That Fast,1,http://markmcb.com/2013/04/27/systems-because-you-cant-count-that-fast/,27 04 15:00
Genetic Evidence of Yogas Impact on the Immune System,1,https://medium.com/pacific-standard/4ede02a4f44a,27 04 15:00
Show HN: A url-based API for images (my weekend project),82,http://mebe.co/,27 04 15:00
Innovative 'down for maintenance' page,1,http://www.codelearn.org/down.html,27 04 15:00
Drawings photographs,2,http://mashable.com/2013/04/26/drawings-photographs/,27 04 15:00
Ask HN: Why the Affiliate Link Hatred?,2,http://news.ycombinator.com/item?id=5618510,27 04 15:00
TokyoCabinet ported to windows,1,https://groups.google.com/forum/?fromgroups=#!topic/ejdb/OwHDLCl0gh4,27 04 15:00
Url not being disclosed at this time,1,http://news.ycombinator.com/item?id=5618497,27 04 14:00
