Title,Points,Url,Time_Posted
$2 Trillion Underground Economy May Be Recovery's Savior,1,http://www.cnbc.com/id/100668336,wednesday349
Why do some people want to cut off a perfectly healthy limb?,2,https://www.readmatter.com/f/do-no-harm/,wednesday350
When empathy becomes insulting,69,http://37signals.com/svn/posts/3513-when-empathy-becomes-insulting,wednesday351
You can only benefit from your own failure.,1,http://idiallo.com/blog/2013/04/you-can-only-benefit-from-your-own-failure,wednesday352
Uncommon advice for video job interviews,1,http://news.ycombinator.com/item?id=5608761,wednesday353
The Harsh Truth About iTunes,6,http://www.cheynewallace.com/harsh_truth_about_itunes/,wednesday354
Denny's Home World: Watchtower Library text is all squares with Wine,1,http://dennygoot.blogspot.com/2013/04/watchtower-library-text-is-all-squares.html,wednesday355
19 Tools We Use To Run Our Startup,1,http://matchist.com/blog/19-tools-we-use-to-run-our-startup/,wednesday356
International Day Against DRM is Friday  May 3rd  2013,1,http://www.dayagainstdrm.org,wednesday357
Why I Pay What I Pay,1,http://boss.blogs.nytimes.com/2013/04/23/why-i-pay-what-i-pay/,wednesday358
37signals Hands Sortfolio Over to New Owners,1,http://sortfolio.com/press/20130425-37signals-sells-sortfolio,wednesday359
Ask HN: Can I visit your SF startup?,2,http://news.ycombinator.com/item?id=5608728,wednesday360
Data on who gives gifts to politicians is now more accessible for California,6,http://www.scpr.org/programs/take-two/2013/04/25/31497/data-on-who-gives-gifts-to-politicians-is-now-more/,wednesday361
Development Environments the Right Way with Vagrant and Puppet,1,http://www.andrewmunsell.com/blog/development-environments-with-vagrant-and-puppet,wednesday362
Amazon Just Might Win The Living Room Free-For-All,1,http://paulgreenberg.com/?p=535,wednesday363
A New Kind of Platform for Building Actually Social Apps.,20,http://qbix.com/blog/index.php/2013/04/a-new-kind-of-platform/,wednesday364
Computer Science Programming Basics in Ruby-O'Reilly Media,1,http://shop.oreilly.com/product/0636920028192.do,wednesday365
Finish More,2,https://medium.com/better-humans/6ff0ee4f13bc,wednesday366
AnyYolk: An open source JS  CSS 3 and Parse game,17,http://blog.parse.com/2013/04/25/anyyolk-a-parse-powered-html5-game/,wednesday367
This Is What Water Will Look Like in Games of the Future,2,http://mashable.com/2013/04/25/video-water-games/,wednesday368
A $2 App That Refocuses Photos Like a $400 Lytro,2,http://gadgetwise.blogs.nytimes.com/2013/04/25/a-2-app-that-refocuses-photos-like-a-400-lytro/?partner=yahoofinance,wednesday369
Get paid $150K+ to make Android more secure,1,http://sbirsource.com/grantiq#/topics/87888,wednesday370
WWDC tickets sold out in 1 minute,1,http://news.ycombinator.com/item?id=5608668,wednesday371
 Terry Moore: Why is 'x' the unknown?,1,http://www.youtube.com/watch?v=YX_OxBfsvbk,wednesday372
Obama administration authorized warrantless surveillance,2,https://www.eff.org/deeplinks/2013/04/report-obama-officials-authorized-new-cybersecurity-warrantless-surveillance,wednesday373
Exploding the urban myths about how to stay safe online,3,http://www.bbc.co.uk/news/technology-22278613,wednesday374
Introducing PICT shoppable photos,2,http://blog.pict.com/,wednesday375
An Online Matchmaker for Designers and Manufacturers,1,http://techonomy.com/2013/04/an-online-matchmaker-for-designers-and-dmanufacturers/,wednesday376
Google searches predict market moves,4,http://www.nature.com/srep/2013/130425/srep01684/full/srep01684.html,wednesday377
Racket is ...,2,http://www.ccs.neu.edu/home/matthias/Thoughts/Racket_is____.html,wednesday378
Using D3 and Meteor to generate SVG,17,http://blog.benmcmahen.com/post/41124327100/using-d3-and-meteor-to-generate-scalable-vector,wednesday379
What is a Startup?,1,http://www.startupcoloradosprings.com/2013/04/24/what-is-a-startup/,wednesday380
New improvements to Twitter for Mac,49,http://blog.twitter.com/2013/04/new-improvements-to-twitter-for-mac.html,wednesday381
Why I Love WebSockets - CTOvision,1,http://ctovision.com/2013/04/why-i-love-websockets/,wednesday382
Ask HN: Good iOS Interview Questions,6,http://news.ycombinator.com/item?id=5608543,wednesday383
5 Reasons Startups Are Afraid of Marketing (and shouldn't be),1,http://www.markevanstech.com/2013/03/29/five-reasons-startups-are-afraid-of-marketing/,wednesday384
On Expectation of Privacy,3,http://www.zdziarski.com/blog/?p=2155,wednesday385
My business card in JSON format,1,http://reminderof.me/json/ruggero,wednesday386
That which does for you  does to you - The Iron Law of Tools,1,http://genehughson.wordpress.com/2012/11/19/the-iron-law-of-tools/,wednesday387
Insightful Quotes On How To Work With Creative People,1,http://designtaxi.com/news/357224/Insightful-Quotes-On-How-To-Work-With-Creative-People/,wednesday388
To PUT or POST?,2,https://www.stormpath.com/blog/put-or-post,wednesday389
Rules For Marketing,1,http://guestpostlabs.com/inbound-marketing-commandments/,wednesday390
3% of the Worlds Oceans. ,2,http://www.theatlantic.com/international/archive/2011/11/the-coming-green-wave-ocean-farming-to-fight-climate-change/248750/2/,wednesday391
Student wrongly tied to Boston Bombing (thanks Reddit) found dead,1,http://www.boston.com/metrodesk/2013/04/25/body-pulled-from-providence-river-that-missing-brown-university-student/VdhQ9rI8u6nGJWsLlGuMuN/story.html,wednesday392
I'm Solving my Problems by Writing,3,http://blog.petesoder.com/blog/2013/04/24/im-solving-my-problems-by-writing/,wednesday393
How do you deal with filing various fed/state taxes?,1,http://news.ycombinator.com/item?id=5608487,wednesday394
Some logo design with creative concepts,3,http://news.ycombinator.com/item?id=5608477,wednesday395
Should we use Abstract class or Interface?,1,http://pixelstech.cn/article/1366044255_Should_we_use_Abstract_class_or_Interface_,wednesday396
In the Wired World  Feeds Drive Trading,1,http://online.wsj.com/article/SB10001424127887324743704578443243287840004.html,wednesday397
Launch of the Short Circuit Report,1,http://www.gaiafoundation.org/news/launch-of-the-short-circuit-report,wednesday398
FinCEN's new regulations are choking Bitcoin entrepreneurs,1,http://www.americanbanker.com/bankthink/fincen-regulations-choking-bitcoin-entrepreneurs-1058606-1.html,wednesday399
Tickets For Apples WWDC 2013 Sell Out In Under 2 Minutes,6,http://techcrunch.com/2013/04/25/apple-wwdc-2013-tickets-sold-out/?,wednesday400
Our Next Megatrend,5,http://daslee.me/our-next-megatrend,wednesday401
In the Wired World  Feeds Drive Trading ,1,http://online.wsj.com/article_email/SB10001424127887324743704578443243287840004-lMyQjAxMTAzMDIwNDEyNDQyWj.html,wednesday402
How to ask startup people for introductions,10,http://alexdschiff.com/post/48861396303/how-to-ask-startup-people-for-introductions,wednesday403
Tickets For Apples WWDC 2013 Sell Out In Under 2 Minutes,66,http://techcrunch.com/2013/04/25/apple-wwdc-2013-tickets-sold-out,wednesday404
Time to scrap affirmative action,3,http://www.economist.com/news/leaders/21576662-governments-should-be-colour-blind-time-scrap-affirmative-action,wednesday405
WWDC Tickets on sale,8,https://developer.apple.com/membercenter/purchase2013Ticket.action,wednesday406
Show HN: Next Generation Content Creation &amp; Online Publishing,1,http://salon.io/howitworks,wednesday407
Developer Auction is using Craigslist for their own hiring,4,http://sfbay.craigslist.org/sfc/eng/3763905207.html,wednesday408
How To Be A CIO And A Woman,1,http://www.informationweek.com/global-cio/interviews/how-to-be-a-cio-and-a-woman/240153590,wednesday409
Understanding the Kernel Trick,1,http://metaoptimize.com/qa/questions/1772/understanding-the-kernel-trick,wednesday410
Show HN: Flinto is fast  shareable  installable iOS prototyping,7,https://www.flinto.com,wednesday411
Ubuntu 13.04 Review: Linux for the average Joe or Jane,3,http://www.zdnet.com/ubuntu-13-04-review-linux-for-the-average-joe-or-jane-7000014521/,wednesday412
Big Data Plus Data Virtualization Equals?,1,http://www.dataversity.net/big-data-plus-data-virtualization-equals/,wednesday413
Turn your photographic library into an interactive &amp; sound-synced movie,1,http://eternallight.io/kick,wednesday414
Show HN:Healthy Brain (iOS app-improve the performance of your brain),1,http://apps.cerait.com/healthybrain/,wednesday415
Ask HN: What are the b2c markets where deals are negotiated?,1,http://news.ycombinator.com/item?id=5608324,wednesday416
Using Simulation to Create Prediction Intervals Around Holt-Winters,1,http://analyticsmadeskeezy.com/2013/04/25/prediction-intervals/,wednesday417
I just wanted a better business card. Today I am releasing this to the public.,1,http://www.ruggero.info/a-reminder-of-me/474/,wednesday418
Questions and Admission: Reflections on 100 000 Admissions Decisions at Stanford,1,http://www.amazon.com/Questions-Admissions-Reflections-Decisions-Stanford/dp/0804731586/,wednesday419
User recognition without cookies or local storage,1,http://stackoverflow.com/questions/15966812/user-recognition-without-cookies-or-local-storage,wednesday420
Ios dev center is down,1,http://devimages.apple.com/maintenance/,wednesday421
"Is it Twitter  or everyone is ""hackable""?",1,http://glipho.com/fbeeper/is-it-twitter-or-everyone-is-hackable,wednesday422
JSON objects can have duplicate keys/names,1,http://tools.ietf.org/html/rfc4627#section-2.2,wednesday423
Box announces HIPAA compliance,3,https://blog.box.com/2013/04/new-platform-partners-for-healthcare-initiative/,wednesday424
Bacon is bad for you,1,http://devslovebacon.com/conferences/bacon-2013/talks/bacon-is-bad-for-you,wednesday425
Ask HN: Freelance programming?,1,http://news.ycombinator.com/item?id=5608256,wednesday426
Behavior Design with Buster Benson  founder of 43Things  HealthMonth  Budge.,1,http://blog.lift.do/post/48240630140/build-habits-in-1-000-steps-our-interview-with-buster,wednesday427
Show HN: The Behance Portfolio Review Site We Made,1,http://www.islreview.com/,wednesday428
Strange Tales From the Frontiers of Resuscitation Medicine,2,http://www.wired.com/wiredscience/2013/04/consciousness-after-death/,wednesday429
CPU Design on Paper,2,http://www.drdobbs.com/embedded-systems/cpu-design-on-paper/240153480,wednesday430
A Waste of Time for Entrepreneurs,1,http://www.forbes.com/sites/stellafayman/2013/04/25/startup-mistakes/,wednesday431
Whats New in Node.js and libuv this Week,7,http://blog.strongloop.com/whats-new-in-node-js-and-libuv-april-25-2013/,wednesday432
Probability and Deuces in Tennis,1,http://www.austinrochford.com/index.html,wednesday433
Forks over knives and Plant based diet,1,http://www.forksoverknives.com/,wednesday434
How to Create Your Reason,1,http://blogs.hbr.org/haque/2013/04/how_to_create_your_reason.html,wednesday435
NodeFlys Node.js News Round-Up for April 25  2013,1,http://blog.nodefly.com/post/48800838324/nodeflys-node-js-news-round-up-for-april-25-2013,wednesday436
The best way to write CSS,1,http://davidyeiser.com/post/2013/apr/object-oriented-css,wednesday437
Sunil Tripathi Update: Body found in waters off Rhode Island park,20,http://www.cbsnews.com/8301-504083_162-57581387-504083/sunil-tripathi-update-body-found-in-waters-off-rhode-island-park-idd-as-brown-university-student-official-says/,wednesday438
How to report a DDoS Attack,1,http://blog.icann.org/2013/04/how-to-report-a-ddos-attack/,wednesday439
Is China covering up another flu pandemic? ,2,http://www.foreignpolicy.com/articles/2013/04/23/the_big_one,wednesday440
Pictures of people who mock me,4,http://www.salon.com/2013/04/23/pictures_of_people_who_mock_me/,wednesday441
Why Your Code's UX Matters,5,http://blog.helloburin.com/post/48854595584/why-your-codes-ux-matters,wednesday442
How to localize your API,30,http://apiux.com/2013/04/25/how-to-localize-your-api/,wednesday443
What Scott Cook Wished He Knew About Being a CEO When He Founded Intuit ,1,http://firstround.com/article/What-Scott-Cook-Wished-He-Knew-About-Being-a-CEO-When-He-Founded-Intuit,wednesday444
Bookshout Closes $6M in Series B Funding,2,http://launchdfw.com/news/bookshout-closes-6m-in-series-b-funding-expands-distribution-and-engagement-platform-for-publishers-and-authors/,wednesday445
Interview with LiveSchools Founder and CEO  Matthew Rubinstein,1,http://jumpstartfoundry.com/2013/04/24/matthew-rubinstein/,wednesday446
New Perspectives On Web Design,1,http://www.smashingmagazine.com/2013/04/23/smashing-book-4-preorder/,wednesday447
Attendees decide between statistics talks,1,http://thomaslevine.com/!/april-25-stats-talks/,wednesday448
How to Get Into Stanford with B's On Your Transcript,1,http://calnewport.com/blog/2010/03/26/how-to-get-into-stanford-with-bs-on-your-transcript-failed-simulations-the-surprising-psychology-of-impressiveness/,wednesday449
Man Convicted of Hacking Despite Not Hacking,31,http://www.wired.com/threatlevel/2013/04/man-convicted-of-hacking-despite-no-hacking/?buffer_share=7c9de&utm_source=buffer&utm_medium=linkedin&utm_campaign=Buffer%253A%252BYaniv%2520Capeluto%2520%2528Kapluto%2529%252Bon%252Blinkedin,wednesday450
Physicists Build Worlds First Magnetic Hose For Transmitting Magnetic Fields,40,http://www.technologyreview.com/view/514201/physicists-build-worlds-first-magnetic-hose-for-transmitting-magnetic-fields/,wednesday451
Building a Sample Application with Haskell Snap and PostgreSQL,3,http://janrain.com/blog/tutorial-building-a-sample-application-with-haskell-snap-postgresql-and-the-postgresql-simple-snaplet/,wednesday452
Earbits (w11) Brings Its Indie Music Discovery Service To Android,2,http://techcrunch.com/2013/04/25/earbits-android-launch/,wednesday453
Turning a critical eye on Yelp,2,"http://www.latimes.com/news/local/la-me-banks-yelp-20130420,0,7824145,full.column",wednesday454
Show HN: A clutter-free dashboard with a twist,3,http://heimdash.com,wednesday455
KrugTron the Invincible,2,http://noahpinionblog.blogspot.com/2013/04/krugtron-invincible.html?m=1,wednesday456
How to reject this code review?,1,http://programmers.stackexchange.com/q/196022/33606,wednesday457
The 10 Commandments of Fundraising Etiquette,1,http://www.techvibes.com/blog/the-10-commandments-of-fundraising-etiquette-2013-04-24,wednesday458
New realtime socket server - Prism,2,https://groups.google.com/forum/#!topic/socketstream/U2PNjainRP0,wednesday459
Designing Apps with Automation in Mind,2,http://www.mendix.com/think-tank/designing-apps-with-automation-in-mind/,wednesday460
The Hottest Person in the Group,1,http://www.naftaliharris.com/blog/tenpeople/,wednesday461
Court denies Grooveshark DMCA protection for songs like Johnny B. Goode,2,http://arstechnica.com/tech-policy/2013/04/court-denies-grooveshark-dmca-protection-for-songs-like-johnny-b-goode/?,wednesday462
SolarCity stock is up 100% since IPO,1,https://www.google.com/finance?chdnp=0&chdd=1&chds=1&chdv=1&chvs=Linear&chdeh=0&chfdeh=0&chdet=1366920000000&chddm=35190&chls=IntervalBasedLine&q=NASDAQ:SCTY&ntsp=1&ei=MFR5UfjjJcKwqwHEzgE,wednesday463
Box.com becomes HIPAA compliant and partners with healthcare startups,1,http://techcrunch.com/2013/04/25/with-hipaa-compliance-cloud-storage-platform-box-makes-a-big-push-into-healthcare-invests-in-drchrono/,wednesday464
Ask HN: Discussion with Ben Franklin.,1,http://news.ycombinator.com/item?id=5607968,wednesday465
Weaknesses of Hire Slow Fire Fast,1,http://www.blog.joelx.com/hiring-slow-firing-fast-problems-of-this-strategy/7668/,wednesday466
Ask HN: WWDC worth the price of admission?,4,http://news.ycombinator.com/item?id=5607937,wednesday467
Windows Phone 8 Viewport Fix,1,http://trentwalton.com/2013/01/16/windows-phone-8-viewport-fix/,wednesday468
MacBook Pro declared 'best performing' Windows laptop,17,http://news.cnet.com/8301-13579_3-57581290-37/macbook-pro-declared-best-performing-windows-laptop/,wednesday469
Targeted Reminders,1,http://softwarerealities.com/2013/04/25/targeted-reminders/,wednesday470
The Best Runs Are Different,2,https://medium.com/what-i-learned-building/1496cba0f0f5,wednesday471
Show HN: BOX'NGO - Online Selling Made Easy,1,http://theboxngo.com/?hn,wednesday472
Conroe company still using computers museums want to put on display,1,http://www.chron.com/news/article/Conroe-company-still-using-computers-museums-want-4459714.php,wednesday473
Meet Apple  the new Microsoft,2,http://qz.com/77964/meet-apple-the-new-microsoft/,wednesday474
A Pirate Metrics Growth Hacker Guide to Blogs,1,http://ssqt.ch/XYhAEx,wednesday475
 Critical app flaw bypasses screen lock on up to 100 million Android phones,2,http://arstechnica.com/security/2013/04/crital-app-flaw-bypasses-screen-lock-on-up-to-100-million-android-phones/,wednesday476
Don't Ask Apple #1 - Non-Removable Batteries,2,http://amistakes.com/2013/04/25/dont-ask-apple-1-non-removable-batteries/,wednesday477
The Truth,4,http://steinarskipsnes.com/the-truth/,wednesday478
"Ask HN: can software be made ""anti-fragile"" (aka ""better than just robust"")?",6,http://news.ycombinator.com/item?id=5607874,wednesday479
Blog Post: Setup Your Amazon Virtual Private Cloud And Secure It With Opsview,2,http://www.opsview.com/whats-new/blog/basics-howto-setup-your-amazon-virtual-private-cloud-and-secure-it-opsview/?utm_source=blog&utm_medium=hackernews&utm_campaign=amazon-vpc,wednesday480
How Ray Kurzweil Will Help Google Make the Ultimate AI Brain,6,http://www.wired.com/business/2013/04/kurzweil-google-ai/,wednesday481
Out of My Depth,14,http://tomtunguz.com/out-of-my-depth,wednesday482
Gearbox acquires Homeworld franchise,1,http://www.gearboxsoftware.com/community/articles/1029/homeworld-acquisition-and-plans,wednesday483
Touch HP Prime Calculator is Cooler Than Anything We Had in School,2,http://www.chipchick.com/2013/04/touch-hp-prime-calculator-is-cooler-than-anything-we-had-in-school.html,wednesday484
Transform a picture in the style of Mondrian with F#,1,http://www.clear-lines.com/blog/post/Transform-a-picture-in-the-style-of-Mondrian-with-FSharp.aspx,wednesday485
The Apple Economy Isn't Done Yet,2,http://www.newyorker.com/online/blogs/johncassidy/2013/04/the-apple-economy-isnt-dead-yet.html,wednesday486
Show HN: I fought through Android docs to make an app for my wedding,1,http://ryanabbott.com/marrying-a-developer-gets-you-more-than-cat-pictures,wednesday487
Lady Gaga Writing A New Song Is Like Investing In A Machine,1,http://www.npr.org/blogs/money/2013/04/25/178901118/lady-gaga-writing-a-new-song-is-like-a-factory-investing-in-a-new-machine?utm_source=NPR&utm_medium=facebook&utm_campaign=20130425,wednesday488
Canada Post and the War on Open Data  Innovation &amp; Common Sense,1,http://eaves.ca/2013/04/25/canada-post-and-the-war-on-open-data-innovation-common-sense-continued-sadly,wednesday489
Will Congress exempt itself from ACA exchange provisions?,1,http://marginalrevolution.com/marginalrevolution/2013/04/will-congress-exempt-itself-from-aca.html,wednesday490
Signs that you're a good programmer,123,https://sites.google.com/site/yacoset/Home/signs-that-you-re-a-good-programmer,wednesday491
Intel's Haswell-powered North Cape reappears; 10h of battery life in tablet-mode,4,http://www.engadget.com/2013/04/25/intel-haswell-north-cape-hands-on-battery-life/?utm_medium=feed&utm_source=Feed_Classic&utm_campaign=Engadget,wednesday492
Is Apples Blossom Fading?,2,http://techonomy.com/2013/04/is-apples-blossom-fading/,wednesday493
Explainer MVP video for my startup,1,http://www.youtube.com/watch?feature=player_embedded&v=CTKOZR3bX-U,wednesday494
Electromagnetic Wave: Hacker festival on an East German fishing vessel in London,24,https://www.emfcamp.org/wave?hn=Hello,wednesday495
Are you any good? I've been playing chess for Millennia...,1,http://www.marydeathcomics.com/1/post/2013/04/war-games.html,wednesday496
Really Simple  Organized  Media Queries with Sass ,1,http://breakpoint-sass.com/,wednesday497
SensioLabsDesktop - GUI for PHP projects,1,http://desktop.sensiolabs.org/,wednesday498
Advanced Multi-Channel Funnel Analysis using Google Analytics,1,http://idea-stack.blogspot.hk/2012/02/advanced-multi-channel-funnel-analysis.html,wednesday499
Memories of Kurt Gdel,1,http://www.rudyrucker.com/blog/2012/08/01/memories-of-kurt-godel/,wednesday500
Retargeting and Remarketing data Standardization,1,http://news.ycombinator.com/item?id=5607768,wednesday501
Retargeting and Remarketing data Standardization,1,http://news.ycombinator.com/item?id=5607767,wednesday502
A Raw and Vulnerable Moment: The Hugalopes Story,1,http://danielodio.com/a-raw-and-vulnerable-moment-the-hugalopes-story,wednesday503
Deploying Python: GitHub to EC2 with OpDemand,3,http://www.opdemand.com/docs/python-quick-start-guide/,wednesday504
We did an elevator pitch for our startup. In an elevator.,1,http://vimeo.com/vuzum/elevatorpitch,wednesday505
The Small Business Guide to YouTube,1,http://www.simplybusiness.co.uk/microsites/youtube-for-small-business/,wednesday506
Why does Europe resent Germany so much?,2,http://www.cbc.ca/news/world/story/2013/04/23/f-pauls-berlin-germanophobia.html?cmp=rss,wednesday507
Transparency Report: More government removal requests than ever before,3,http://googleblog.blogspot.com/2013/04/transparency-report-more-government.html?utm_source=feedburner&utm_medium=feed&utm_campaign=Feed%3A+blogspot%2FMKuf+%28Official+Google+Blog%29&utm_content=Google+Reader,wednesday508
PlayStation 4 lead architect reveals secrets behind Sonys next console,1,http://www.theverge.com/2013/4/25/4264222/mark-cerny-interview-ps4-technical-details,wednesday509
Yahoo! yanks Saturday Night Live from Hulu,2,http://arstechnica.com/business/2013/04/yahoo-yanks-saturday-night-live-from-hulu/,wednesday510
Google: More government removal requests than ever before,2,http://googleblog.blogspot.co.uk/2013/04/transparency-report-more-government.html,wednesday511
Google Conference Bike,1,http://www.wired.com/wiredenterprise/2013/04/google-bikes/?utm_source=feedburner&utm_medium=feed&utm_campaign=Feed%3A+wired%2Findex+%28Wired%3A+Top+Stories%29,wednesday512
SimCity's 2.0 Patch Adds Tons Of Bugs,41,http://www.uproxx.com/gammasquad/2013/04/simcitys-2-0-patch-adds-tons-of-bugs/,wednesday513
Do you know the difference between RFID and NFC?,2,http://blog.atlasrfidstore.com/rfid-vs-nfc,wednesday514
Herokus log-runtime-metrics Can Crash Your Rails App,10,http://siliconisland.ca/2013/04/25/herokus-log-runtime-metrics-can-crash-your-rails-app/,wednesday515
A tool for structural comparison of programs,1,https://github.com/yinwang0/ydiff,wednesday516
Ask HN: Is there going to be startup school 2013?,1,http://news.ycombinator.com/item?id=5607673,wednesday517
Mars Rover Draws Graffiti,2,http://www.dvice.com/2013-4-25/mars-rover-draws-obscene-graffiti-red-planets-surface,wednesday518
Connected China,1,http://connectedchina.reuters.com/,wednesday519
LinkedIn Turns Its Contacts Section Into A Personal Assistant,3,http://techcrunch.com/2013/04/25/linkedin-turns-its-contacts-section-into-a-personal-assistant-with-google-yahoo-evernote-outlook-apps-integration-and-a-standalone-iphone-app/,wednesday520
Examining Payment Gateways and Failed Transactions,1,http://blog.spreedly.com/?p=208,wednesday521
Propagation Delay and Its Relationship to Maximum Cable Length,75,http://www.wildpackets.com/resources/compendium/ethernet/propagation_delay,wednesday522
SmartMow: Safest lawn mower in the world,1,http://www.indiegogo.com/projects/smartmow-robotic-lawn-mower/x/3108985,wednesday523
How a UCLA professor gamed a game theory midterm,14,https://www.quora.com/Visakan-Veerasamy/Posts/Cheating-to-Learn-How-a-UCLA-professor-gamed-a-game-theory-midterm,wednesday524
The Mole Rat Prophecies,1,http://www.damninteresting.com/the-mole-rat-prophecies/,wednesday525
An open letter to Innocean and Hyundai,1,http://copybot.wordpress.com/2013/04/25/an-open-letter-to-innocean-and-hyundai/,wednesday526
Job Board for those working in Big Data,1,http://www.bigdatajobs.com,wednesday527
 Your verdict on whether to continue building this ,1,http://www.voyando.com,wednesday528
Our Feel-Good War on Breast Cancer,130,http://www.nytimes.com/2013/04/28/magazine/our-feel-good-war-on-breast-cancer.html?_r=0&pagewanted=all,wednesday529
NYC Startups to Watch,30,http://www.timeinc.com/pressroom/10nycstartups.php,wednesday530
Case Studies: How to Build Online Businesses That Gross $250 000+ Per Month,2,http://www.fourhourworkweek.com/blog/2013/04/24/how-to-online-business/,wednesday531
Tourists Emails Can be Searched at Israels Borders,1,http://www.acri.org.il/en/2013/04/24/ag-tourists-israel-emails/,wednesday532
East London Tech City Startups To Get Access To Network Of 4G Hotspots In June,2,http://techcrunch.com/2013/04/25/tech-city-4g-hotspots/,wednesday533
Show HN: Tweets on Air - AirTweet,1,http://airtweet.com/,wednesday534
Ubuntu Saucy Salamander,3,http://www.markshuttleworth.com/archives/1252,wednesday535
The importance of animations in UI design,1,https://medium.com/design-ux/926eb80d64e3?read,wednesday536
Capsule  The Developers Code Journal,1,http://alexking.org/blog/2013/04/24/capsule-the-developers-code-journal,wednesday537
Whos doing Mobile Discovery (clueits probably not you),1,http://blog.shhmooze.com/2013/04/25/whos-doing-mobile-discovery-clue-its-probably-not-you/,wednesday538
LinkedIn Contacts: a smarter way to keep in touch,1,http://blog.linkedin.com/2013/04/25/introducing-the-new-linkedin-contacts-a-smarter-way-to-stay-in-touch-slideshow/,wednesday539
How heavy metal riffs stimulate our brains,2,http://www.deathmetal.org/news/why-metal-riffs-delight-us/,wednesday540
Retargeting Gone Wrong,1,http://www.dataxu.com/2013/04/24/retargeting-gone-wrong/,wednesday541
SF Restaurant Sign Calls Yelp Bully  Integrity of Reviews Questioned,84,http://foodbeast.com/content/2013/04/22/sf-restaurant-calls-out-yelp-for/,wednesday542
