Title,Points,Url,Time_Posted
How Apple's Developer Conference Grew Too Big for Its Own Developers,47,http://www.wired.com/gadgetlab/2013/04/why-wwdc-is-too-big/?utm_source=feedburner&utm_medium=feed&utm_campaign=Feed%3A+wired%2Findex+%28Wired%3A+Top+Stories%29,thursday528
Check the status of your branches,3,https://github.com/blog/1484-check-the-status-of-your-branches,thursday529
Why Online Education is Mostly a Fantasy,2,http://pandodaily.com/2013/04/25/why-online-education-is-mostly-a-fantasy/?utm_source=feedly,thursday530
When rewards backfire: intrinsic and extrinsic motivation,1,http://www.spring.org.uk/2009/10/how-rewards-can-backfire-and-reduce-motivation.php,thursday531
"Washington Attorney General disputes T-Mobile's ""No Contract"" claim",1,http://www.atg.wa.gov/pressrelease.aspx?&id=31166,thursday532
Exoplanet discovery count by year,32,http://exoplanet.eu/diagrams/?t=h&f=&x=discovered&xmin=&xmax=&y=raw&ymin=&ymax=,thursday533
UCSB Scientists Create Device Capable of Detecting Narcotics and Explosives,1,http://dailynexus.com/2013-04-16/ucsb-scientists-create-device-capable-of-detecting-narcotics-and-explosives/,thursday534
Business model: Steal-a-business-model (Rocket Internet Business Presentation),1,http://www.nyemission.nu/resources/RocketInternet.pdf,thursday535
The 30 day free trial is mostly broken,39,http://blog.clinchpad.com/post/48920850979/the-30-day-free-trial-is-mostly-broken,thursday536
All-plastic 3D-printed gun will be available to download in 2 weeks.,2,http://www.extremetech.com/extreme/154344-complete-all-plastic-3d-printed-gun-will-be-available-to-download-in-two-weeks,thursday537
The Lottery,1,http://hypercritical.co/2013/04/26/the-lottery,thursday538
Why Sleep Deprivation Eases Depression,156,http://www.scientificamerican.com/article.cfm?id=why-sleep-deprivation-eases-depression,thursday539
Free NASA publications,1,http://www.hq.nasa.gov/office/hqlibrary/ic/ic2.htm#pubs,thursday540
Google's Schmidt says talking to glasses can be weird  inappropriate,2,http://www.reuters.com/article/2013/04/25/us-google-harvard-idUSBRE93O1FF20130425?feedType=RSS,thursday541
The design process of my infographic about women cycling for Grinta,1,http://veerle.duoh.com/design/article/the_design_process_of_my_infographic_about_women_cycling_for_grinta,thursday542
Zelda: A link to the CSS,2,http://hop.ie/blog/zelda/,thursday543
"""Today I Did Something I Never Thought Possible Yesterday""",1,http://seanmeverett.quora.com/Today-I-did-something-I-never-thought-was-possible-yesterday,thursday544
One less JPG,2,http://fourkitchens.com/blog/2013/04/24/one-less-jpg,thursday545
Obama to daughters: If you get a tattoo  so will I,1,http://www.youtube.com/watch?v=otgavDcDcBg,thursday546
Colours,3,http://webcolourdata.com/,thursday547
10 things youll love about MSNGR,1,http://msngr.in/10-things-youll-love-about-msngr,thursday548
Death To The Waterfall,1,http://nathanieldeal.tumblr.com/post/48782713373/death-to-the-waterfall,thursday549
Blue For The Pineapple (MITM box),1,http://penturalabs.wordpress.com/2013/04/25/blue-for-the-pineapple/,thursday550
Betatrophin: A Hormone that Controls Pancreatic  Cell Proliferation,1,http://www.cell.com/abstract/S0092-8674(13)00449-2,thursday551
The Devil Is In The Data,1,https://medium.com/trends-predictions/df018e3f131,thursday552
TUAW: Quicklytics is the Analytics client that Google should have made,1,http://www.tuaw.com/2013/04/25/daily-ipad-app-quicklytics-is-the-analytics-client-that-google/,thursday553
Blink  A New App For Ephemeral Text And Photo Messaging  Arrives On iPhone,2,http://techcrunch.com/2013/04/26/blink-a-new-app-for-ephemeral-text-and-photo-messaging-arrives-on-iphone/,thursday554
Post Mortem: Recent Build Infrastructure Issues,1,http://about.travis-ci.org/blog/2013-04-26-post-mortem-build-infrastructure-issues/,thursday555
Rediscovering a cloud: OS-less instances  ephemeral services  no sysadmins,1,http://www.erlangonxen.org/blog/rediscovering-cloud,thursday556
Right to Share: Principles on Freedom of Expression and Copyright in Digital Age,1,http://www.article19.org/resources.php/resource/3716/en/,thursday557
Linux: start / stop / restart apparmor daemon,2,http://linuxapachemysqlphp5.blogspot.com/2013/04/linux-start-stop-restart-apparmor-daemon.html,thursday558
 Bitcoin: the Berlin streets where you can shop with virtual money,6,http://www.guardian.co.uk/technology/2013/apr/26/bitcoins-gain-currency-in-berlin,thursday559
Ubuntu 8.04 server  10.04 desktop and 11.10 reaching End of Life on May 9 2013,1,http://linuxapachemysqlphp5.blogspot.com/2013/04/ubuntu-804-hardy-heron-server-1004.html,thursday560
The complete guide to not giving a f*#k,8,http://inoveryourhead.net/the-complete-guide-to-not-giving-a-fuck/,thursday561
Rankings Are For Rookies,1,http://www.interactually.com/rankings-are-for-rookies/,thursday562
If Management is the Only Way Up  Were All Fd,2,http://moz.com/rand/if-management-is-the-only-way-up-were-all-fd/,thursday563
The Next  and Overlooked  VC Opportunity: The Middle East,1,http://www.wamda.com/2013/04/the-next-and-overlooked-vc-opportunity-the-middle-east,thursday564
Essential Elisp libraries,62,http://www.wilfred.me.uk/blog/2013/03/31/essential-elisp-libraries/,thursday565
Two Changes To Quirky Could Change The World,1,http://tech.slashdot.org/story/13/04/25/1931201/two-changes-to-quirky-could-change-the-world,thursday566
Thoughts on CommonJS / RequireJS,1,http://lisperator.net/blog/thoughts-on-commonjs-requirejs/,thursday567
Brian Cohen says that his fellow angel investors need to get tougher,1,http://upstart.bizjournals.com/entrepreneurs/hot-shots/2013/04/25/brian-cohen-says-angels-should-get-tough.html,thursday568
How to Manage Content Marketing with an Editorial Calendar [Free Template],1,http://blog.brightpod.com/how-to-manage-content-marketing-with-an-editorial-calendar-free-template/,thursday569
How to unite several separate projects into one general Visual Studio solution,1,http://www.viva64.com/en/b/0198/,thursday570
Zach Braff Raises $1.5 Million in One Day on Kickstarter,1,http://www.rollingstone.com/movies/news/zach-braff-raises-1-5-million-in-one-day-on-kickstarter-20130425,thursday571
5 Simple Ways to Cut the Costs of Building an App,1,http://www.ideatoappster.com/app-on-a-budget-5-simple-ways-to-cut-the-costs-of-building-an-app/,thursday572
Responsive Inspector,1,http://outof.me/responsive-inspector-beta-released/,thursday573
Instant Refund? Dont bank on it,1,http://letstalk.globalservices.bt.com/en/security/2013/04/instant-refund-dont-bank-on-it/,thursday574
Six Pre-Requisites for the New Wave of Enterprise IT Security Solutions,1,http://venturefizz.com/blog/six-pre-requisites-new-wave-enterprise-it-security-solutions,thursday575
The secret behind habit formation,1,http://blog.champapp.net/the-secret-behind-habit-formation/,thursday576
How Algorithms Rule the World,1,http://www.fastcompany.com/3000830/how-algorithms-rule-world,thursday577
Explainer: How Corruption Is Strangling U.S. Innovation,3,http://blogs.hbr.org/cs/2013/04/explainer_how_corruption_is_st.html?utm_source=feedburner&utm_medium=feed&utm_campaign=Feed%3A+harvardbusiness+%28HBR.org%29,thursday578
The state of Audio in HTML5 Games,1,http://indiegamr.com/the-state-of-audio-in-html5-games/,thursday579
Inspiring Mothers,1,http://www.theatlantic.com/sponsored/inspiring-mothers,thursday580
Omelette: Simple Autocompletion Helper for Node.js,35,https://github.com/f/omelette?gif,thursday581
Using LESS.JS and ASP.NET MVC 4,1,http://adamjohnston.me/2013/04/26/using-less-js-and-asp-net-mvc-4/,thursday582
B2B Lead Generation - top content marketing strategies,1,http://hub.productworld.com/bid/286723/B2B-Lead-Generation-top-content-marketing-strategies,thursday583
Of Languages and Translation and the Millions yet to be made,1,http://trak.in/startup/languages-translation-millions-to-be-made/,thursday584
ATM Skimmers,84,http://krebsonsecurity.com/2010/01/would-you-have-spotted-the-fraud/,thursday585
Why this took us 3.5 years to build,1,https://moot.it/blog/technology/you-spent-3.5-years-on-this.html,thursday586
Show HN: Pleasantly colorful collaborative shopping list with ability to predict,1,http://www.rainbowshoppinglist.com,thursday587
Show HN: SimpleBackpacker,1,http://simplebackpacker.com/,thursday588
Why Your Brain Loves That New Song,1,http://news.sciencemag.org/sciencenow/2013/04/why-your-brain-loves-that-new-so.html?ref=hp,thursday589
Eavesdropping on a wireless keyboard,1,http://windytan.blogspot.fr/2013/03/eavesdropping-on-wireless-keyboard.html,thursday590
Find max subarray of an array,1,http://www.pixelstech.cn/article/1366649413_Find_max_subarray_of_an_array,thursday591
"A teacher fades away (follow-up to ""I was a college newspaper advisor"")",1,http://www.jeffpearlman.com/a-teacher-fades-away/,thursday592
Using Celery for queuing requests,4,http://blog.serverdensity.com/using-celery-for-queuing-requests/,thursday593
Apple's WWDC tickets sell out in two minutes,1,http://www.macworld.co.uk/ipad-iphone/news/?newsid=3444223&olo=rss,thursday594
Picking tech for your startup,81,http://blog.opbeat.com/2013/04/26/picking-tech-for-your-startup/,thursday595
Counting Google searches predicts market movements,2,http://www.nature.com/news/counting-google-searches-predicts-market-movements-1.12879,thursday596
Alternative Medicine and the Vulnerable Child,1,http://www.sciencebasedmedicine.org/index.php/alternative-medicine-and-the-vulnerable-child-2/,thursday597
Mandiant: No Drop in Chinese Hacking.,1,http://blogs.wsj.com/chinarealtime/2013/04/24/mandiant-no-drop-in-chinese-hacking-despite-talk,thursday598
Kickborn will be part of smartphones,1,http://kickborninfo.wordpress.com/2013/04/24/kickborn-first-100-usr/,thursday599
Inside the Cycleplex: The Weird  Wild World of Google Bikes,1,http://www.wired.com/wiredenterprise/2013/04/google-bikes/all/,thursday600
Falcon: supersonic micro-framework for building WSGI APIs by Rackspace,1,https://github.com/racker/falcon,thursday601
On Copycat Whales  Conformist Monkeys and Animal Cultures,1,http://phenomena.nationalgeographic.com/2013/04/25/on-copyca-whales-conformist-monkeys-and-animal-cultures/,thursday602
BlackBerry Invents 007-Styled Wearable Computer Accessory,1,http://www.patentbolt.com/2013/04/blackberry-invents-007-styled-wearable-computer-accessory.html,thursday603
KDE Announces the Akademy 2013 Presentation Schedule,1,http://dot.kde.org/2013/04/25/fast-mobile-accessible-akademy-2013-sessions,thursday604
Windows high speed logging: ETW in C#/.NET,2,http://blogs.msdn.com/b/vancem/archive/2012/08/13/windows-high-speed-logging-etw-in-c-net-using-system-diagnostics-tracing-eventsource.aspx,thursday605
Words are more powerful than aesthetics,1,http://area20.com/words-are-more-powerful-than-aesthetics/,thursday606
The Art of Negotiation,1,http://blog.azzist.com/,thursday607
Show HN: My tool to divide up tasks so everyone does less work,1,http://fairandsquare.ie/app/chore/,thursday608
The Story of the Rainbow Ghost  fairytale for kids  today (26.4.2013) for free,1,http://www.amazon.com/The-Story-Rainbow-Ghost-ebook/dp/B00AMNAD2U/ref=sr_1_1?s=digital-text&ie=UTF8&qid=1366780055&sr=1-1&keywords=story+of+the+rainbow+ghost,thursday609
Top 5 Reasons Why China Is Hacker Heaven,20,http://www.ridehelios.com/blog/top-5-reasons-why-china-is-hacker-heaven/,thursday610
Scientists detect dark lightning linked to visible lightning,2,http://www.agu.org/news/press/pr_archives/2013/2013-15.shtml,thursday611
Reading into Alcatel-Lucents ProgrammableWeb Decision,1,http://blog.cimicorp.com/?p=1258&goback=%2Egde_4156686_member_235575623,thursday612
Hacked.IO - learning  building and sharing cool stuff,2,http://hacked.io/tickets/,thursday613
ProgrammableWeb Gets Acquired  Again  This Time By MuleSoft,1,http://thenextweb.com/insider/2013/04/23/programmableweb-the-destination-for-all-things-api-gets-acquired-again-this-time-by-mulesoft/?utm_medium=Spreadus&utm_campaign=social%20media&awesm=tnw.to_f0e0B&utm_source=Twitter,thursday614
Friday Freak Out  Stop The Desperation to Blog About Facebook,1,http://www.thesocialpenguinblog.com/2013/04/26/friday-freak-out-stop-the-desperation-to-blog-about-facebook/,thursday615
Microsoft prevails in Xbox patent rift with Motorola Mobility,1,http://www.pcworld.com/article/2036431/microsoft-prevails-in-xbox-patent-rift-with-motorola-mobility.html,thursday616
Intro text: part of the header or body?,2,http://www.onderhond.com/features/html-musings/html-structure-intro,thursday617
Rediscovering a cloud of the future,2,http://erlangonxen.org/blog/rediscovering-cloud,thursday618
Lard: after decades of trying  its moment is finally here.,2,http://www.slate.com/articles/life/food/2009/06/lard.single.html,thursday619
Tight investors force young entrepreneurs offshore,20,http://www.abc.net.au/news/2013-04-26/tight-aussie-investors-force-young-entrepreneurs-offshore/4653828,thursday620
Falsely accused student of Boston attacks confirmed dead,18,http://www.bbc.co.uk/news/world-us-canada-22297568,thursday621
Mcafee patents anti piracy filter,2,http://www.techspot.com/news/52363-mcafee-patents-anti-piracy-filter.html,thursday622
Facebook acquires Parse,1,https://developers.facebook.com/blog/?mkt_tok=3RkMMJWWfF9wsRonuq%2FLZKXonjHpfsX56uolWqW3lMI%2F0ER3fOvrPUfGjI4ATcJkI%2BSLDwEYGJlv6SgFTbHGMblmy7gNUxU%3D,thursday623
How Bitcoin works,1,http://visual.ly/bitcoin-infographic,thursday624
 I'm holding an introductory Rails workshop in Bangalore on May 4th,1,http://mindthegeek.com/workshops/1,thursday625
Ask HN: Best Rich Text Editor,1,http://news.ycombinator.com/item?id=5612180,thursday626
Uber Stockholm throw a PR-tantrum when refused unfair advantages,189,http://www.digitalmcgyver.com/professional/digital-pr/uber-stockholm-throw-a-pr-tantrum-when-refused-unfair-advantages/,thursday627
UX Manifesto: 7 Principles for Better Software,6,http://devproconnections.com/development/ux-manifesto-7-principles-better-software,thursday628
After Last Couple of Weeks  It's Clear There Is Big Opportunity In The API Space,1,"http://blog.apievangelist.com/2013/04/25/after-last-couple-of-weeks,-its-clear-there-is-big-opportunity-in-api-the-space/",thursday629
Judge rejects FBI's bid to hack computer of suspect in attempted cyberheist,1,http://www.pcworld.com/article/2036423/judge-rejects-fbis-bid-to-hack-computer-of-suspect-in-attempted-cyberheist.html,thursday630
Galaxy S4 Display Technology Shootout,2,http://www.displaymate.com/Galaxy_S4_ShootOut_1.htm,thursday631
Ask HN: Music is my inspiration while working. Where do you discover yours?,1,http://news.ycombinator.com/item?id=5612136,thursday632
Against The Arts,1,http://www.firstthings.com/blogs/leithart/2013/04/25/against-the-arts/,thursday633
What If We Never Run Out of Oil? ,74,http://www.theatlantic.com/magazine/archive/2013/05/what-if-we-never-run-out-of-oil/309294/?single_page=true,thursday634
"Kubuntu 13.04 ""Raring Ringtail"" brings KDE SC 4.10 and Linux 3.8",1,http://www.kubuntu.org/news/kubuntu-13.04,thursday635
Open-source ChatHeads for iOS implementation on GitHub,1,https://github.com/brutella/chatheads,thursday636
Crowdsourcing Is The Answer To Youth Unemployment And Giving Business A Boost,1,http://www.huffingtonpost.co.uk/adam-ball/crowdsourcing-youth-unemployment_b_3137086.html,thursday637
Windows XP still runs on 39% of computers currently in use,1,http://www.economist.com/blogs/babbage/2013/04/operating-systems,thursday638
You dont need a job,2,http://www.themiddlefingerproject.org/you-dont-need-a-job-you-need-guts/,thursday639
Blender 2.67 Release Candidate,4,http://wiki.blender.org/index.php/Dev:Ref/Release_Notes/2.67,thursday640
The Year of Email,1,http://islandofatlas.net/2013/04/26/the-year-of-email.html,thursday641
Software who can entertain human queries - List of successful queries,1,http://kickborninfo.wordpress.com/2013/04/24/kickborn-first-100-user/,thursday642
Flat Design and Color Trends,114,http://designmodo.com/flat-design-colors/,thursday643
Asynchronous Loggers for Low-Latency Logging,37,http://logging.apache.org/log4j/2.x/manual/async.html#Performance,thursday644
London's tech city - a Nordic perspective,1,http://www.arcticstartup.com/2013/04/09/a-nordic-perspective-on-londons-tech-city,thursday645
How to foster a culture of innovation in France,1,http://www.rudebaguette.com/2013/04/05/report-from-french-goverment-proposes-19-measures-to-foster-a-culture-of-innovation-in-france,thursday646
Serbia startup scene,1,http://venturevillage.eu/serbia,thursday647
Firefox: HiDPI support  HTML5 notifications  Parallel JS  asm.js,10,https://hacks.mozilla.org/2013/04/hidpi-support-html5-notifications-parallel-js-asm-js-and-more-firefox-development-highlights/,thursday648
A brief lesson in letter-writing,1,http://timharford.com/2013/04/a-brief-lesson-in-letter-writing/,thursday649
Interactive insights on multi-channel marketing,1,http://analytics.blogspot.com/2013/04/introducing-customer-journey-to-online.html,thursday650
When Your Twitter Friend Turns Out To Be The Boston Bomber,1,http://digg.com/originals/dzhokhar-tsarnaev-twitter-map,thursday651
The Raspberry Pi in scientific research,2,http://www.raspberrypi.org/archives/3798,thursday652
Feedly fixing reviews? Google Chrome Store,2,https://chrome.google.com/webstore/detail/feedly-your-news-rss-goog/hipbfijinpcgfogaopmgehiegacbhmob/reviews,thursday653
Your Kickstarter Vacation. My Money. No.,1,http://i.gadling.com/2013/04/25/your-kickstarter-vacation-my-money-no/,thursday654
Scrum is risky,1,http://www.wittenburg.co.uk/Entry.aspx?id=dce9dde8-d770-47c2-ad66-937cfabadb59,thursday655
Google closes Facebook's loophole  bans non-Play Store app updates in Android,7,http://www.theverge.com/2013/4/26/4269074/google-play-store-ban-third-party-facebook-android-app-update,thursday656
Ask HN: What is your daily reading list?,104,http://news.ycombinator.com/item?id=5611973,thursday657
From zero to hello world in Node.js on Azure using the Raspberry Pi in 3 mins.,2,http://coderead.wordpress.com/2013/04/15/publishing-a-node-js-website-to-azure-from-the-raspberry-pi-in-3-mins/,thursday658
10 Best CSS Practices to Improve Your Code,1,http://www.webdesignerdepot.com/2009/05/10-best-css-practices-to-improve-your-code/,thursday659
Show HN: our mouse drawn startup intro cartoon - stamplin,1,http://www.youtube.com/watch?v=touYjqcG2jA,thursday660
Instagram's API broken again,2,https://groups.google.com/forum/?fromgroups=#!topic/instagram-api-developers/ncB18unjqyg,thursday661
Multiply is closing,1,http://thebobbery.com/multiply-to-shut-down-on-may-31-2013/,thursday662
Facebook disallows sharing of politically charged blog posts? ,1,http://scriptonitedaily.wordpress.com/2013/04/25/facebook-censors-users-during-media-blackout-on-privatisation-of-the-nhs/,thursday663
Patterns For Large-Scale JavaScript Application Architecture,1,https://speakerdeck.com/addyosmani/large-scale-javascript-application-architecture,thursday664
How to plan your web design investment,1,http://www.revelate.de/blog/04/2013/how-plan-your-web-design-investment,thursday665
Freeze CPAN deps with PAUSE git,1,http://weblog.bulknews.net/post/48794875384/freeze-cpan-deps-with-pause-git,thursday666
You have no hidden talent,2,http://rrn.dk/you-have-no-hidden-talent,thursday667
Einstein's theory of relatively seen in action by astronomers,1,http://www.telegraph.co.uk/science/space/10019380/Einsteins-theory-of-relatively-seen-in-action-by-astronomers.html,thursday668
Fix Chrome caching of Source Maps,1,http://rathersplendid.net/home/fix-chrome-caching-of-source-maps,thursday669
Andrew Keen &amp; Robert Scoble chat about Google Glass,1,http://tnw.2gzr.com/517940f8531a484b777dae06,thursday670
Live Video coverage from The Next Web Europe conference,1,http://tnw.2gzr.com/,thursday671
Top Ten CSS Tricks Article,1,http://www.sitepoint.com/top-ten-css-tricks/,thursday672
The Lean approach is sound  you just need to convince your clients,3,http://www.uvd.co.uk/blog/the-lean-approach-is-sound-you-just-need-to-convince-your-clients/,thursday673
We want to deploy your nodejs code.,2,https://nudow.com?source=hn04262013,thursday674
Now also Austria develops its own Internet meme culture.,2,http://digitalsirocco.tumblr.com/post/48865811590/memes-globale-internet-witze-werden-mit,thursday675
What makes code hard to understand,1,http://arxiv.org/pdf/1304.5257v1.pdf,thursday676
North Korea Sees Huge Growth in 3G Users with 2M Subscribers,1,http://www.techinasia.com/north-korea-3g-subscribers-2-million/,thursday677
China's Leadership is Really  Really Rich,2,http://www.theatlantic.com/china/archive/2013/04/chinas-leadership-is-really-really-rich/275316/,thursday678
Blib - a tool for seeing your Internet latency,6,http://apenwarr.ca/log/?m=201304#26,thursday679
Retrospective bill modification,2,http://www.iank.it/airtel-loses-a-friend/,thursday680
Maxucks  Episode 3,1,http://amistakes.com/2013/04/26/maxucks-episode-3/,thursday681
What Happened When One Man Pinged the Whole Internet,12,http://www.technologyreview.com/news/514066/what-happened-when-one-man-pinged-the-whole-internet/,thursday682
In Defense of Older Workers: Theres No Substitute for Experience And Maturity,2,http://www.linkedin.com/today/post/article/20130425040156-8451-in-defense-of-older-workers-there-s-no-substitute-experience-and-maturity,thursday683
Why Turkey is hot,1,http://www.sinaafra.com/why-turkey-is-hot-2013-update,thursday684
Property-based testing: what is it?,1,http://blog.jessitron.com/2013/04/property-based-testing-what-is-it.html,thursday685
How To Create an Ownership Mentality on Your Team,9,http://www.thedailymuse.com/career/3-ways-to-create-an-ownership-mentality-within-your-team/,thursday686
Mars One opens applications for one-way ticket to Mars,1,http://www.wired.co.uk/news/archive/2013-04/25/mars-one-applications,thursday687
WWDC - If you added the ticket to the cart  you might be good,9,http://news.ycombinator.com/item?id=5611755,thursday688
Facebook ebay's data centers now more transparent (for power usage).,2,http://greenmonk.net/2013/04/22/facebook-and-ebays-data-centers-are-now-more-transparent/,thursday689
Technical Discrepancies In The Movie Oblivion (Spoiler Alert),1,http://blog.vctr.me/posts/technical-discrepancies-in-the-movie-oblivion.html,thursday690
GetViable attracts over 400 entrepreneurs in first 20 days since launch.,2,http://www.shoestring.com.au/2013/04/get-viable-attracts-over-400-entrepreneurs-in-first-20-days-since-launch/,thursday691
Paper: Making Reliable Distributed Systems In The Presence Of Software Errors,2,http://highscalability.com/blog/2013/4/25/paper-making-reliable-distributed-systems-in-the-presence-of.html,thursday692
Practices in source code sharing in astrophysics,67,http://arxiv.org/abs/1304.6780v1,thursday693
Is there a blogging threshold for your startup?,4,http://news.ycombinator.com/item?id=5611698,thursday694
Craftstud.io - A Game to Make Games (now in beta),104,http://craftstud.io/?hnbeta,thursday695
Show HN: Still single like me? Try Kloser.me,3,http://kloser.me,thursday696
Small Realizations of Big Entrepreneurs [infographic],1,http://fundersandfounders.com/small-realizations-of-big-entrepreneurs/,thursday697
Parse (YC S11) Acquired By Facebook,1,http://ycuniverse.com/parse-acquired-by-facebook,thursday698
Aaron Swartz Documentary Seeks Funding on Kickstarter,2,http://mashable.com/2013/04/25/aaron-swartz-documentary/,thursday699
Don't Blame All of Reddit for Boston Bombing Witch Hunt,2,http://mashable.com/2013/04/24/reddit-boston-bombing/,thursday700
Destroy your file system (virtually) in Lunduke's Experimental AI Terminal,1,http://www.joystiq.com/2013/04/23/destroy-your-file-system-virtually-in-lundukes-experimental-a/,thursday701
Google bans self-updating apps in the Play Store,6,https://play.google.com/about/developer-content-policy.html?rd=1#dangerous,thursday702
Reddit User Who Started FindBostonBombers Quits Reddit ,1,http://www.huffingtonpost.com/2013/04/23/reddit-boston-ama_n_3138623.html,thursday703
Facebook Challenges Yelp With Mobile Pages Redesign Featuring Actions,1,http://techcrunch.com/2013/04/23/facebook-mobile-pages/,thursday704
Ecuadorian cubesat is in orbit,1,http://pegaso.exa.ec/index-en.html,thursday705
The Best Experimental Chrome Features You Should Check Out,1,http://lifehacker.com/the-best-experimental-chrome-features-you-should-check-478620752,thursday706
Coming soon to Linux: A lightweight KDE alternative,3,http://www.pcworld.com/article/2036169/coming-soon-to-linux-a-lightweight-kde-alternative.html,thursday707
When to use applets instead of HTML forms: Three easy techniques,1,http://www.javaworld.com/javaworld/jw-04-2013/130422-applet-alternatives-to-html-forms.html,thursday708
An open standard for the Internet of things by IBM  Cisco and others.,1,http://bits.blogs.nytimes.com/2013/04/25/a-messenger-for-the-internet-of-things/,thursday709
Edir Macedo  Brazil's Billionaire Bishop,1,http://www.businessweek.com/articles/2013-04-25/edir-macedo-brazils-billionaire-bishop,thursday710
Are games on Apples App Store curated or censored?,1,http://business.financialpost.com/2013/04/22/is-apples-app-store-curated-or-censored/,thursday711
Use shame.css to house CSS hacks  says dev,1,http://www.netmagazine.com/news/use-shamecss-house-css-hacks-says-dev-132699,thursday712
Automate Favorite Tweet for Leads,1,http://blog.raywu.co/post/48789349293/automate-favorite-tweet-for-leads,thursday713
Sublime Text 2 Tips ,1,http://pradeepjain.com/56/,thursday714
HTML5 mobile games monetization with advertisements ,1,http://www.gamasutra.com/blogs/PrzemyslawSzczepaniak/20130422/190982/HTML5_mobile_games_monetization_with_advertisements__does_it_really_work_for_us.php,thursday715
