Title,Points,Url,Time_Posted
DRM framework for HTML5 may restrict playback of copyrighted web content,1,http://www.houstonianonline.com/news/drm-framework-for-html5-may-restrict-playback-of-copyrighted-web-content-1.2825775#.UXt0Psp9Ugs,27 04 03:00
Corsera video interaction technology.,2,http://news.ycombinator.com/item?id=5617065,27 04 03:00
 Binify for hexagon binning in Python,1,http://flowingdata.com/2013/04/25/binify-for-hexagon-binning-in-python/,27 04 03:00
Blogging and Making Money from Your Advice - via email,1,http://www.remailproject.com/2013/04/blogging-and-making-money-from-your.html,27 04 03:00
Litecoin,8,http://litecoin.org/,27 04 03:00
ARM expands its Development Studio 5 IDE to embedded Linux applications,4,http://www.theinquirer.net/inquirer/news/2263879/arm-expands-its-development-studio-5-ide-to-embedded-linux-applications,27 04 03:00
Open Source JBoss Application Server Reborn as WildFly,1,http://www.internetnews.com/software/open-source-jboss-application-server-reborn-as-wildfly.html,27 04 03:00
Comparison of XMPP based Group Chat and IRC based Group Chat,16,http://gaglers.com/blog/2013/04/27/xmpp-group-chat-versus-irc/,27 04 03:00
Behold Ubuntu Server 13.04: Focus on hypervisors and OpenStack,2,http://www.theregister.co.uk/2013/04/24/canonical_ubuntu_server_13_04/,27 04 03:00
Google founders limit salaries to $1,4,http://www.washingtonpost.com/business/technology/google-founders-limit-salaries-to-1-while-4-other-top-execs-receive-a-combined-124-million/2013/04/24/cecc8792-ad3b-11e2-a8e6-b6e4cc7c49d1_story.html,27 04 03:00
Google Tests Search Without Instant Previews,1,http://techcrunch.com/2013/04/24/google-tests-search-without-instant-previews-moves-sharing-tool-cached-and-similar-pages-to-new-drop-down-menu/,27 04 03:00
Driving Google Street View with Leap Motion ,1,http://www.youtube.com/watch?v=1-lXnyFm_Wc,27 04 03:00
Google even more of a 'control freak' than Apple?,1,http://money.msn.com/top-stocks/post.aspx?post=d9872558-e869-4aea-9f9c-7a15f30ff0be,27 04 03:00
Why Medium Notes Are Different (Comments VS in-line notes),1,https://medium.com/about/5972c72b18f2,27 04 03:00
Stop Using Small Font Sizes,5,https://explodie.org/writings/stop-using-small-font-size.html,27 04 03:00
NuGet for C++ now available,1,http://blogs.msdn.com/b/vcblog/archive/2013/04/26/nuget-for-c.aspx,27 04 03:00
DDoS Attack Looks Like an Intense Game of Pong,1,http://mashable.com/2013/04/26/ddos-attack-visualized/,27 04 03:00
Googles Matt Cutts Says It Is Okay To Link Your Sites Together,1,http://searchengineland.com/googles-matt-cutts-says-it-is-okay-to-link-your-sites-together-but-in-moderation-157141,27 04 03:00
Ask NEAs Pete Sonsini On The Next Disruptive Startup In The Enterprise,1,http://techcrunch.com/2013/04/26/ask-a-vc-neas-pete-sonsini-on-the-next-disruptive-startup-in-the-enterprise/,27 04 03:00
20 Exceptional CSS Boilerplates and Frameworks,2,http://mashable.com/2013/04/26/css-boilerplates-frameworks/,27 04 03:00
App Of The Day type apps can help indies with app discovery,1,http://www.altdevblogaday.com/2013/04/26/app-of-the-day-type-apps-can-help-indies-with-app-discovery/,27 04 03:00
A Users Guide To Disrupt NY 2013,1,http://techcrunch.com/2013/04/26/a-users-guide-to-disrupt-ny-2013/,27 04 03:00
How Technology Has Made Me a Better Mom,1,http://mashable.com/2013/04/26/technology-better-mom/,27 04 03:00
What Did Alexander Graham Bell Sound Like?,1,http://techland.time.com/2013/04/26/listen-what-did-alexander-graham-bell-sound-like/,27 04 03:00
Judge  Jury and Programmer,1,http://devcomsystems.com.au/2013/04/judge-jury-and-programmer/,27 04 02:00
The Retirement Gamble Facing Us All,2,http://www.pbs.org/wgbh/pages/frontline/business-economy-financial-crisis/retirement-gamble/the-retirement-gamble-facing-us-all/,27 04 02:00
Sven Olaf Kamphuis Arrested For Biggest Cyber Attack In Internet History,1,http://newsbytesnow.com/2013/04/26/flash-dutch-suspect-sven-olaf-kamphuis-arrested-for-biggest-cyber-attack-in-internet-history/,27 04 02:00
'Junk DNA' is comments,1,http://www.netfunny.com/rhf/jokes/91q3/genome.html,27 04 02:00
Today I gave the wrong answer to a customer,30,http://carokopp.com/post/48015412277/today-i-gave-the-wrong-answer-to-a-customer,27 04 02:00
Do Whales Have Culture? Humpbacks Pass on Behavior,6,http://news.nationalgeographic.com/news/2013/13/130425-humpback-whale-culture-behavior-science-animals/,27 04 02:00
Plotting Time Series with Pandas DatetimeIndex and Vincent,2,http://wrobstory.github.io/2013/04/pandas-vincent-timeseries.html,27 04 02:00
What Apples stock buyback shows about corporate tax games,2,http://www.washingtonpost.com/business/economy/what-apples-stock-buyback-shows-about-corporate-tax-games/2013/04/25/bcd6dc9a-adea-11e2-8bf6-e70cb6ae066e_story.html,27 04 02:00
Full House: The Spread of Excellence from Plato to Darwin,1,http://en.wikipedia.org/wiki/Full_House:_The_Spread_of_Excellence_from_Plato_to_Darwin,27 04 02:00
MS Open Tech celebrates one year anniversary ,2,http://msopentech.com/about/,27 04 02:00
Building an ARM blade server,65,http://vincentsanders.blogspot.co.uk/2013/04/when-you-make-something-cleaning-it-out.html,27 04 02:00
Story of what took place from the Boston bomber carjacking victim,1,http://pastebin.com/28kh8RwJ,27 04 02:00
Golang vs JAVA vs PHP: Comparing productivity,3,http://mindfsck.net/golang-vs-java-vs-php-comparing-productivity/,27 04 01:00
Nervous Parents In One Country Clear Supermarket Shelves In Another,76,http://www.npr.org/blogs/money/2013/04/26/179222522/nervous-parents-in-one-country-clear-supermarket-shelves-in-another,27 04 01:00
Despite technology  travel discovery sucks.,3,http://news.ycombinator.com/item?id=5616811,27 04 01:00
Ask HN: Why is Objectivism shunned by the common public?,1,http://news.ycombinator.com/item?id=5616806,27 04 01:00
DDoS attacks on Mt. Gox delay rollout of new virtual currency,28,http://arstechnica.com/security/2013/04/potent-ddos-attacks-on-mt-gox-delays-rollout-of-new-virtual-currency/?id=mrb,27 04 01:00
Obsession,339,http://pastebin.com/3RSUzfDk,27 04 01:00
Mark Zuckerbergs political group funds ads promoting Keystone and ANWR drilling,7,http://grist.org/news/mark-zuckerbergs-political-group-funds-ads-promoting-keystone-and-anwr-drilling/,27 04 01:00
The Strenuous Life,1,http://benyu.org/the-strenuous-life,27 04 01:00
Geek and repetitive tasks,1,https://plus.google.com/+BrunoOliveira/posts/MGxauXypb1Y,27 04 01:00
Zuck reaped $2.3B gain on stock options,1,http://finance.yahoo.com/news/facebook-ceo-reaped-2-3b-232622341.html,thursday1
If You Dont Stop Mind Reading Now  Youll Hate Yourself Later,1,http://www.anxietyguru.net/if-you-dont-stop-mind-reading-now-youll-hate-yourself-later/,thursday2
Left 4 Dead 2 for Linux public beta releasing next week,1,http://www.polygon.com/2013/4/25/4267978/left-4-dead-2-for-linux-public-beta-releasing-next-week,thursday3
From Land to Water: the Origin of Whales  Dolphins  and Porpoises,2,http://link.springer.com/article/10.1007/s12052-009-0135-2/fulltext.html,thursday4
Ask HN: Are you going to stay away from Parse after the Facebook acquisition?,4,http://news.ycombinator.com/item?id=5616728,thursday5
Modeling Information Availability,1,http://blog.bowlabs.org/2013/04/27/an-information-availability-graph/,thursday6
"""Captain Beto""  first Argentine nano satellite  placed into orbit",3,http://500gadgets.com/page/was-placed-into-orbit-the-captain-beto-first-argentine-nano-satellite.html,thursday7
Space Junk Threat Demands Immediate Action  Experts Say,4,http://www.space.com/20832-space-junk-cleanup-needed.html?cmpid=514639,thursday8
Momentum vs compatibility in open source,3,http://www.futurealoof.com/posts/momentum.html,thursday9
Instant visualization of your Internet latency via JavaScript,2,http://apenwarr.ca/log/?m=201304,thursday10
Week 1 Review - Living 48 Laws of Power,1,http://channikhabra.github.io/blog/2013/04/22/week-1-rule-1-living-48-laws-of-power/,thursday11
SSL/TLS Deployment Best Practices,1,https://www.ssllabs.com/projects/best-practices/index.html,thursday12
Gallery of single page websites,6,http://onepagelove.com/?ref=hn,thursday13
The Season for Growing Trees,1,http://www.jmillville.com/trees/,thursday14
Blookist - a beautiful  way to tell your stories ,1,http://www.sssimpli.com/articles/blookist-a-beautiful-way-to-tell-your-stories,thursday15
Dad Draws Different Lunch Bag Art Every Day Since 2008,1,http://mashable.com/2013/04/26/sandwich-art/,thursday16
Worst part about working at Google,3,http://www.quora.com/Working-at-Google-1/Whats-the-worst-part-about-working-at-Google,thursday17
DropSmack: Using Dropbox to steal files and deliver malware,1,http://www.techrepublic.com/blog/security/dropsmack-using-dropbox-to-steal-files-and-deliver-malware/9332,thursday18
Talk It Out: Live Chat with Entrepreneurs  Founders  and Investors,1,http://www.talkitout.me/,thursday19
"People laugh when i say ""i dont know how it's going to make money""",4,http://news.ycombinator.com/item?id=5616639,thursday20
I'm Ashamed,1,http://blogeasyapp.com/blog/im-ashamed/,thursday21
Photoshop is not a page layout tool,1,http://www.antetype.com/blog/2013/04/guest-post-photoshop-is-not-a-page-layout-tool/,thursday22
Real Map of the internet,1,http://internetcensus2012.bitbucket.org/hilbert/index.html,thursday23
'Pure Android' - Adapting an iPad design to Android tablets,2,http://lukesleeman.com.au/building-accor-directory/,thursday24
A bug worth 4200$,2,http://filosottile.github.io/a-bug-worth-4200%24/,thursday25
The blog is running EXTREMELY slow. Can you find out why?,1,http://news.ycombinator.com/item?id=5616581,thursday26
Interview process and set of questions to find your next to Software Engineer,1,http://blog.binarymist.net/2013/04/27/software-engineer-interview-process-and-questions/,thursday27
Profession  by Isaac Asimov,1,http://www.abelard.org/asimov.php,thursday28
Fixing Toxic Online Behavior in League of Legends,72,http://www.gamasutra.com/view/news/191262/Video_Fixing_toxic_online_behavior_in_League_of_Legends.php,thursday29
Need Advice on building a web service,1,http://news.ycombinator.com/item?id=5616526,thursday30
Bad Tech Job Interview Questions (and How To Answer Them),2,http://blog.smartbear.com/software-quality/bid/280171/bad-tech-job-interview-questions-and-how-to-answer-them,thursday31
StackMob Builds Importer app for angry Parse App developers,2,http://techcrunch.com/2013/04/26/stackmob-parse/,thursday32
SublimeText2 Auto FileHeader,2,https://github.com/fjctlzy/zyfileheader/,thursday33
Ask HN: What should be my next language design/compiler project?,1,http://news.ycombinator.com/item?id=5616490,thursday34
Tumblr's old iOS app used to have a hidden  Twitter #Music-style feature ,1,http://jeffrock.com/tumblr-play.html,thursday35
Netflix Looks Back on Its Near-Death Spiral,5,http://www.nytimes.com/2013/04/27/business/netflix-looks-back-on-its-near-death-spiral.html?pagewanted=all,thursday36
New features on Restangular: the ultimate Rest API client for AngularJS,1,http://www.blogeek.com.ar/2013/04/26/new-features-on-restangular-the-ultimate-rest-api-client-for-angularjs/,thursday37
A robot that can steal things out of vending machines,1,http://io9.com/so-this-is-a-robot-that-can-steal-things-out-of-vending-482396162,thursday38
This Woman Wants to Be Your Networking Wingman,4,http://www.fastcoexist.com/1681787/this-woman-wants-to-be-your-networking-wingman?utm_source=feedly&utm_medium=feed&utm_campaign=Feed%3A+fastcompany%2Fheadlines+(Fast+Company),thursday39
Was it even used? Google Removes Instant Previews From Search Results,2,http://www.makeuseof.com/tag/google-removes-instant-previews-from-search-results-adds-a-dropdown-for-cached-and-similar-results-updates/,thursday40
The Biggest Price-Fixing Scandal Ever,171,http://www.rollingstone.com/politics/news/everything-is-rigged-the-biggest-financial-scandal-yet-20130425?src=longreads,thursday41
Kickjannic - kickstarter job resume,2,http://www.kickjannic.com/,thursday42
Hacking a vending machine with a robot,1,http://newyork.grubstreet.com/2013/04/french-inventor-vending-machine-hacker.html?mid=facebook_nymag,thursday43
First attempt to fix a bug of chromium,1,http://zhchbin.github.io/Coding/2013/04/25/first-attempt-to-fix-a-bug-of-chromium/,thursday44
Random bug cuts off iMessages sent with the iPhone,2,http://arstechnica.com/apple/2013/04/random-bug-cuts-off-imessages-sent-with-the-iphone/,thursday45
Creating a hacking environment for girls in Chicago,21,https://www.piggybackr.com/seabdalla/chicago-girls-in-computing-encourage-girls-in-tech-fundraiser,thursday46
Indie Game  the movie,1,http://www.youtube.com/watch?v=j9CuFO8H8yo,thursday47
AT&T; predictions of the future from 1993.,2,http://www.nebojsa.me/att-predictions-of-the-future-from-1993/,thursday48
Google+ Interactive Posts - Intro  Tutorial  &amp; Tool,1,http://www.swellpath.com/2013/04/google-plus-interactive-posts/,thursday49
How to get good at building wireframes,1,http://arnorhs.com/2013/04/26/how-to-be-great-at-building-ui-wireframes/,thursday50
Why personal projects may need version control system?,1,http://www.mymindleaks.com/article/why-personal-projects-need-version-control-systems.html#.UXsmXIzJKSc.hackernews,thursday51
Colorplane  a color picker for humans (made with canvas),3,http://33cc77.com/tools/colorplane/,thursday52
Study suggests US companies use overseas workers to cut wages,2,http://www.theregister.co.uk/2013/04/26/us_companies_foreign_comapies_study/,thursday53
KDevelop 4.5.0 Released,2,http://www.kdevelop.org/45/kdevelop-450-released,thursday54
Whitehouse Petition To Drone Bomb The WBC,1,https://petitions.whitehouse.gov/petition/drone-bomb-westboro-baptist-churchs-homes/Gzf5P701,thursday55
Markov Chain Algorithm in PHP,4,https://github.com/gburtini/Learning-Library-for-PHP/blob/master/lib/unsupervised/markovchain.php,thursday56
Ask HN: Gut instinct quote for this Android Project,1,http://news.ycombinator.com/item?id=5616365,thursday57
Don't write code you won't get credit for,1,http://nikwakelin.com/blog/2013/04/24/dont-write-code-you-wont-get-credit-for/,thursday58
Winamps woes: how the greatest MP3 player undid itself (2012),82,http://arstechnica.com/business/2012/06/winamp-how-greatest-mp3-player-undid-itself/#,thursday59
Sk8trakr - Discover &amp; keeptrack of your skate tricks in real-time,1,http://sk8trakr.com,thursday60
SVG / CSS masking using mask-image and clip-path,1,http://germanforblack.com/post/48894844472/recently-i-worked-with-art-processors-to-create,thursday61
A 75-Year Harvard Study Finds What It Takes To Live A Happy Life,2,http://www.businessinsider.com/grant-study-reveals-what-makes-us-happy-2013-4,thursday62
Kim Komando has been successful for decades for a reason.,2,http://techland.time.com/2013/04/26/kim-komando-explains-pcs-circa-1994/,thursday63
Ender.js - the no-library JavaScript library,1,http://ender.jit.su,thursday64
LivingSocial hacked,1,http://venturebeat.com/2013/04/26/livingsocial-hacked/,thursday65
Google officially acquires news summary app Wavii  immediately shuts it down,2,http://www.theverge.com/2013/4/26/4269894/google-acquires-news-summary-app-wavii,thursday66
Appfog announces shutdown of Rackspace option,5,http://news.ycombinator.com/item?id=5616275,thursday67
Message Box - Chat Heads all over jailbroken iOS,3,https://github.com/b3ll/MessageBox,thursday68
Ask HN: Best Shopping Cart Solution?,1,http://news.ycombinator.com/item?id=5616211,thursday69
Google glass root hack easy claims developer,1,http://www.ibtimes.co.uk/articles/461827/20130426/google-glass-root-hack-easy-claims-developer.htm,thursday70
3D printer makes tiny human liver (w/ video),1,http://www.newscientist.com/article/dn23419-3d-printer-makes-tiniest-human-liver-ever.html,thursday71
The Rise of Big Data,1,http://www.foreignaffairs.com/articles/139104/kenneth-neil-cukier-and-viktor-mayer-schoenberger/the-rise-of-big-data,thursday72
What bothers me about Googles AppEngine,4,http://matthewpaulmoore.com/post/48621135502/what-bothers-me-about-googles-appengine,thursday73
Meet Mr. Money Mustache  the man who retired at 30,304,http://www.washingtonpost.com/business/meet-mr-money-mustache-the-man-who-retired-at-30/2013/04/26/71e3e6a8-acf3-11e2-a8b9-2a63d75b5459_print.html,thursday74
International Chocolate Monthly,1,http://www.indiegogo.com/projects/monthly-chocolate-box-from-around-the-world/x/2454099#intro,thursday75
Contact Forms with Pure JavaScript,38,https://squaresend.com/blog/sending-emails-with-javascript,thursday76
Doctors Denounce Cancer Drug Prices of $100 000 a Year,5,http://www.nytimes.com/2013/04/26/business/cancer-physicians-attack-high-drug-costs.html?pagewanted=all&_r=1&,thursday77
What A 16th Century British Currency Can Teach Journalism,2,http://blog.priceonomics.com/post/48953395530/what-a-16th-century-british-currency-can-teach,thursday78
ITER fusion project advances,6,http://www.independent.co.uk/news/science/one-giant-leap-for-mankind-13bn-iter-project-makes-breakthrough-in-quest-for-nuclear-fusion-a-solution-to-climate-change-and-an-age-of-clean-unlimited-energy-8590480.html,thursday79
Evidence mounts that a single antibody could knock out many cancers,10,http://stanmed.stanford.edu/2012summer/article7.html,thursday80
Reddit is no longer a link aggregator  it is an image board,6,http://www.reddit.com/r/TheoryOfReddit/comments/zhy66/reddit_is_no_longer_a_link_aggregator_it_is_an/,thursday81
Node.js Application Monitoring with the NodeFly Dashboard  Part Two,1,http://blog.nodefly.com/post/48961128824/node-js-application-monitoring-with-the-nodefly,thursday82
Editr: HTML  CSS  JS Playground script,1,https://github.com/Idered/editr,thursday83
Preloading of images for hover states,1,http://christian-fei.com/tutorials/preloading-images-for-hover-states/,thursday84
Replacing WWDC,21,http://www.marco.org/2013/04/26/replacing-wwdc,thursday85
Revenue Canada says BitCoins aren't tax exempt,2,http://www.cbc.ca/news/business/story/2013/04/26/business-bitcoin-tax.html,thursday86
Survey says travelers unhappy with current vacation rental sites,2,http://blogs.zaranga.com/2013/04/26/results-of-vacation-rental-survey/,thursday87
Google bans self-updating Android apps  possibly including Facebooks,1,http://arstechnica.com/information-technology/2013/04/google-bans-self-updating-android-apps-possibly-including-facebooks/,thursday88
Infoliberalism  or how the Internet can replace the traditional political order,38,http://infoliberalism.info/,thursday89
#muckedup Chat Tuesday: Digital Reporting - Best Or Worst Job Of 2013?,1,http://blog.muckrack.com/post/48960285296/muckedup-chat-tuesday-digital-reporting-best-or,thursday90
What Crimes are you Guilty of?,3,http://www.trialbytimeline.org.nz/,thursday91
Emoticons get more emotional  thanks to Berkeley psychologists,1,http://newscenter.berkeley.edu/2013/04/26/psychologists-emoticons/,thursday92
Learning To Code: Get A Degree  Or Just Teach Yourself?,1,http://readwrite.com/2013/04/26/is-it-better-to-learn-to-code-at-school-or-at-home-infographic,thursday93
Mountain Lab: An Interview With Scott McGuire,1,http://v-e-n-u-e.com/Mountain-Lab-An-Interview-with-Scott-McGuire,thursday94
Celebrating 450 000 Appcelerator Mobile Developers,1,http://www.appcelerator.com/developers/450k/,thursday95
Chrome asks for Facebook password on... Google.com?,1,http://blog.vrypan.net/2013/4/27/chrome-asks-fb-password-on-googlecom/,thursday96
LivingSocial Hacked  More Than 50 Million Accounts Compromised,2,http://blog.sucuri.net/2013/04/livingsocial-hacked-more-than-50-million-accounts-compromised.html,thursday97
Chak de Hockey - A Punjabi ice hockey broadcast,1,http://www.nytimes.com/2013/04/28/sports/hockey/chak-de-goal-a-punjabi-show-draws-new-hockey-fans.html,thursday98
Scientists Have 3D-Printed Mini Human Livers for the First Time Ever,1,http://gizmodo.com/5995271/scientists-have-3d+printed-mini-human-livers-for-the-first-time-ever,thursday99
Ask HN: How do you read news?,1,http://news.ycombinator.com/item?id=5615868,thursday100
Bittorrent Sync Secret: NJDU6IRJTUM5YF24XQVXTY6X43WC3RKX,7,http://news.ycombinator.com/item?id=5615867,thursday101
Rails Strap Twitter Bootstrap Theme for Rails,3,https://wrapbootstrap.com/theme/rails-strap-ruby-ready-theme-WB00952P7,thursday102
What It Takes to Create a Start-Up Community,1,http://boss.blogs.nytimes.com/2013/04/26/what-it-takes-to-create-a-start-up-community/?smid=tw-share,thursday103
Mapping the Hilbert curve,4,http://bit-player.org/2013/mapping-the-hilbert-curve,thursday104
Old photos telling a story of gritty New York,1,http://www.dailymail.co.uk/news/article-2134408/Never-seen-photos-100-years-ago-tell-vivid-story-gritty-New-York-City.html,thursday105
Probably written by a bot : Hadoop Poses a Big Data Security Risk,1,http://www.eweek.com/security/slideshows/hadoop-poses-a-big-data-security-risk-10-reasons-why/,thursday106
Why the UK Snooper's Charter is a costly mistake,1,http://revk.www.me.uk/2013/04/snoopers-charter.html,thursday107
Facebook CEO cashes out $2.3B in stock options,3,http://www.usatoday.com/story/money/business/2013/04/26/facebooks-mark-zuckerberg-made-22-billion-on-options-in-2012/2116529/,thursday108
Dictionary words as HEX color codes,1,http://jsfiddle.net/icodeforlove/wuHLm/show/,thursday109
Revenue Canada says BitCoins aren't tax exempt,1,http://www.cbc.ca/news/business/story/2013/04/26/business-bitcoin-tax.html?cmp=rss,thursday110
Facebook Director Jim Breyer To Step Down,1,http://www.bloomberg.com/news/print/2013-04-26/facebook-says-director-jim-breyer-won-t-seek-re-election-in-june.html,thursday111
Carjacking victim describes harrowing night,2,http://www.bostonglobe.com/metro/2013/04/25/carjack-victim-recounts-his-harrowing-night/FX6CAnypP1NbrMuPFb6zTM/story.html?s_campaign=sm_tw,thursday112
Show HN: I've built a 'game' using WebRTCs DataChannel (Chrome only),1,http://demo.tiemenwaterreus.com:8080,thursday113
Dart Talk at HTML5 User Group London,1,http://skillsmatter.com/podcast/ajax-ria/html5-user-group-april/wd-23,thursday114
You Dont Own Your Logo (&amp; Why You Think You Do): Why Copyright Transfer Matters,1,http://blog.kunvay.com/you-dont-own-your-logo-and-why-you-think-you-do-why-copyright-transfer-matters-copyright-assignment-copyright-agreement-copyright-form/,thursday115
Creating a Radial Menu in CSS,300,http://stackoverflow.com/questions/13132864/circular-tooltip/13137862#13137862,thursday116
Startup hacks the brain to help make you a better athlete,2,http://www.geekwire.com/2013/ikkos/,thursday117
Building a Rotating CSS Cube (Stack Overflow),3,http://stackoverflow.com/questions/9812196/css-3d-animation-how/14421939#14421939,thursday118
Jor1k: OpenRISC 1000 emulator written in JavaScript running Linux,2,http://s-macke.github.com/jor1k,thursday119
Salesforce  the pillow maker and the $125 000 Amex bill,3,http://www.itworld.com/software/354146/salesforce-pillow-maker-and-125000-amex-bill,thursday120
Buffon's needle simulation,1,http://changingbit.blogspot.com.br/2013/04/buffons-needle-simulation.html,thursday121
What your users really want,2,http://www.singhrahul.com/2013/04/what-your-users-really-want.html,thursday122
Band forces fans to hack for clues about new album,1,http://www.factmag.com/2013/04/26/next-boards-of-canada-code-found-hidden-in-messageboard-banner-might-include-title-of-new-record/,thursday123
Nutritionist Criticizes Soylent as Dangerous and Unhealthy,6,http://www.businessinsider.com/rob-rhinehart-food-substitute-eating-disorder-2013-3,thursday124
9/11 Plane Debris Found in Lower Manhattan,18,http://blogs.wsj.com/metropolis/2013/04/26/911-airplane-debris-found-more-than-a-decade-later/?mod=e2fb,thursday125
NY police: Landing gear part apparently from 9/11 hijacked jet found,1,http://www.cnn.com/2013/04/26/us/new-york-9-11-plane-part/index.html?sr=fb042613planepartny5p,thursday126
Behind The Scenes of the New Kippt (YC S12),3,http://theindustry.cc/2013/04/26/behind-the-scenes-of-the-new-kippt/,thursday127
What If We Never Run Out of Oil?,15,http://www.theatlantic.com/magazine/archive/2013/05/what-if-we-never-run-out-of-oil/309294/,thursday128
Greylock Hackfest - 07.27.2013,1,http://techcrunch.com/2013/04/23/greylock-partners-accepting-second-hackfest-applications-names-judges-and-launches-new-university-site/,thursday129
Born Rich,2,http://www.halfsigma.com/2008/02/born-rich.html,thursday130
Swype VP confirms talks with Apple on revolutionary keyboard technology,9,http://9to5mac.com/2013/04/26/swype-vp-confirms-talks-with-apple-on-revolutionary-keyboard-technology/,thursday131
What is a linked list?,1,http://softwarecake.com/post/29053008425/what-is-a-linked-list,thursday132
Photon-to-electron conversion: Two for one - Shockley-Queisser Limit Broken,5,http://web.mit.edu/newsoffice/2013/photon-to-electron-conversion-0418,thursday133
Mozilla's Anonymous Usage Tracking is not that Anonymous,1,http://browserfame.com/1502/mozillas-anonymous-usage-tracking-is-not-that-anonymous,thursday134
Flynn - transparent web animations simplified.,1,http://flynn.thisismess.com,thursday135
Patents As Weapons: 1-800-CONTACTS Using The Patent System To Kill Startup,4,http://www.techdirt.com/blog/startups/articles/20130420/23340522780/patents-as-weapons-how-1-800-contacts-is-using-patent-system-to-kill-innovative-startup.shtml,thursday136
The Truth About Entrepreneurs: Twice As Many Are Over 50 As Are Under 25,137,http://www.pbs.org/newshour/rundown/2013/04/the-truth-about-entrepreneurs-twice-as-many-are-over-50-than-under-25.html,thursday137
How a bicycle is made video (1945),2,http://vimeo.com/39401575,thursday138
Hiring Software Product Generalists,4,http://news.ycombinator.com/item?id=5615596,thursday139
